comment,like,bad
"日本の自称リベラルが加害者擁護に傾倒するのは当然です昔から彼らのお仲間である極左過激派の擁護に必死でしたからね被害者感情なんか二の次三の次です。立憲の元議員だった平岡氏なんか被害者家族に面と向かって「加害者にもそれなりの事情があるんです」なんて言ってましたので唖然としました。",1,1
"目には目をがそもそもの刑法の考え方です。江戸時代では15歳から極刑が適用されてます。6億円位請求しても普通な話ですからかなり安くて親子で返せる可能性もあります。ここまで情けをかけて反論するなら更に金額を増やすべきです。だいたいこういった人間は社会に迷惑な大人になる。払えなければ極刑が良い。十両盗めばそうなる時代もありそれが治安の基になっていたわけです。",2,1
"加害者の将来なんて加害者自身が考えればいいこと。本人が考えつかないのなら将来はない。それが一番シンプルだ。これまでもそうやって幾万人もが社会的或いは生物学的に死んできた。身勝手な加害の事実を歪めてまで上から何やらうす甘い道筋を提示してやるから、将来を考えつかない奴らが群がって類似の事犯を起こす。SNSで叩かれた可哀想な僕/私をマスコミが救ってくれたという道筋を欲しがっているだけに見える。",2,1
"本当の加害者は、自分とは全く関係ないのに「一生償え」「破滅しろ」「地獄に落ちろ」と騒いでる、姿を現さない善良な市民とかいうヤツだからでしょうね。株価なんて常時変動してるモノを振りかざし、さもそれだけの実害があったかのように捲し立てる。今も株価下がったままですか？と言いたい。実際、被害者であるスシローの社長ですら、その時々で上下する株価云々を言うのはナンセンスだと否定してると言うのに。訴訟の時は吹っ掛けるのが常なので、実際には常識的な金額に落ち着くでしょうが、それを残念に思う人が一定数いるのも確か。事件とは全く関係ないけど、他人の不幸は蜜の味とばかりに破滅するのを願ってる「善良な」一般国民とやらが、こぶしを振り上げて喚き散らしてるんでしょう。",2,1
"若いから更正の可能性はあるが、このワルガキが覚悟決めて自分でやるしかないことだし周囲も本人にやらせるようにしないとダメだよ若いしカワイソーだからスシローが仕事作ってやれば良いとかテキトーで無責任に甘やかす大人も増えたねそーゆーの見抜かれてこの手のワルガキ増殖の流れになってんだよまースシローの今後の対応要チェック",1,1
"他国とは社会が違います。他国では犯罪を行っても、金銭賠償の場合は破産、刑事事件なら刑期を終える、それでちゃんと真人間扱いしますし、しなければならないのです。日本のように、いつまでもいつまでも「彼は犯罪者だった」と後ろ指刺される社会ではないのです。日本は正直反省するだけ無駄だし、金なら払い損です。日本人がもっとクールにならなければ西洋風のルールは基本的に無駄です。",2,1
"スシローさんの損害金額と賠償請求金額を対比して考える。風評被害も加味する。ならば２桁のディスカウント価格と思いますよ。加害者の更正を考えるならマグロ漁船に乗せるのが良いと思いますよ。",1,1
"飲食店は客を選べない商売。それが、全国に定着している。都市部不動産賃貸などのように客をむちゃくちゃ選別する商売もある。特に飲食店には社会的にも人間的にも選別されたことのない未完成、無自覚な未成年がやっている。自己中心的で破壊的な未成年なやってくるし、未成年でなくても自己中心的で無自覚な大人もやってくる。安く客は多いが、選別できない。これがすべて。",1,1
"この行為がどれだけ危険なのか誰も言いませんが　もし加害者が感染症にでもかかっていたなら客に対するテロですね　事故なら少しは擁護もできるが、これは少年が自ら反省して正しい道に進むべきこと！車は強制保険と任意保険に加入している人がほとんどです。",1,1
"ある元野球選手でタレントの方が「下働きというか、裏方さんの業務をやらせるのも一つの手」「少年を育成、教育の観点からも（スシローが更生の手助けをすれば）イメージが上がる」と、少年の更生について語ったこの元野球選手は誰なのか知りませんが、この方の発言、何から何までおかしい。この人がいうその業務をされている方に対して失礼！どんな職種でもそこはそのプロがしてくれている。罰ゲームのような言い方をするな！それと被害者側がなぜ加害者の更正の手伝いをしないといけない？バカにしてんの！？加害者は醤油差しだけじゃなく世間も舐めてる。反省してると言いつつ、請求棄却を求めるって意味わからん。それは反省してないやん。はっきり言って6700万で済んでよかったやん、って言いたいぐらい。親も親やと思うけど。我が子がかわいいならそこはちゃんと子供自身に6700万払わせれ。死に物狂いで仕事して稼いで払え。",1,1
"ある元野球選手でタレントの方が「下働きというか、裏方さんの業務をやらせるのも一つの手」「少年を育成、教育の観点からも（スシローが更生の手助けをすれば）イメージが上がる」と、少年の更生について語ったこの元野球選手は誰なのか知りませんが、この方の発言、何から何までおかしい。この人がいうその業務をされている方に対して失礼！どんな職種でもそこはそのプロがしてくれている。罰ゲームのような言い方をするな！それと被害者側がなぜ加害者の更正の手伝いをしないといけない？バカにしてんの！？加害者は醤油差しだけじゃなく世間も舐めてる。反省してると言いつつ、請求棄却を求めるって意味わからん。それは反省してないやん。はっきり言って6700万で済んでよかったやん、って言いたいぐらい。親も親やと思うけど。我が子がかわいいならそこはちゃんと子供自身に6700万払わせれ。死に物狂いで仕事して稼いで払え。",1,1
"まあSNSがここまで普及する前からテラ豚丼(牛丼だったか？)やGを揚げてみたとかが動画にあり、動画が気軽に獲れないもっと前なら仲間内でしか知らんもあっただろう。でも、裏方やればやちょっと温情をというのは間違ってると思う。クソ大学生が悪ふざけした蕎麦屋なんか、老舗の頑張って経営立て直した店潰されて、はした金だけ渡されて終わりだよ。今回はチェーン店でデカいからまだ踏ん張れたけど潰れた店にも同じこと言えるのかな？余談だけど、私の下請けのあんちゃん珍しい場所で仕事したと写真撮って数人しか見てない動画にあげたら数時間後にオーナーから物凄い勢いで怒鳴られてたよ。絶対撮影禁止エリアでの撮影、極秘情報が朧気に写ってたようで。私の会社まで飛び火＆数千万単位の受注吹っ飛び寸前で上層部が平謝りで収まったけど。なんでバレたのかも謎だけど必ず誰か見てることを意識した方がいい",1,1
"未来ある少年を更生させるのに賠償金の請求は1番良いと思う。別に6700万で人生が終わるわけでもないし、真に更生してこれからの人生を一生懸命頑張ればいくらでも挽回できる。",2,1
"この子も反省していますと親は言っているらしいが、この親が世間に言うべき事は、こんな子供に育てた事の謝罪でしょう。いかに教育できない親なのかと思うよ。他の食品テロについても同等に厳しく対応すべきです。",1,1
"これが日本だよな。家族が惨殺されても加害者が少年だと「更生の道ガー」とか「少年にも未来ガー」とかギャグみたいなこと本気で言い出す奴らが湧いてくる。今回のを子供の悪ふざけ程度なのにとか、金額が高すぎるとか言う人は本当に社会がわかってない学生やニートなのかと思いきや、意外と普通の大人までそんなこと言ってやがる。社会的影響はどの程度なのか、チェーン店各社の被害額、ユーザーの声など鑑みれば至極当然。自分も親なので、加害者の親は気の毒だと思うけど仕方ない。他にもたくさん同じような事やって拡散されてる奴らにも同じように賠償させねーとな。",3,1
"子供のやった事、イタズラだから、遊び心で、とかそれでやったことが許されてしまう事は余りに甘過ぎると言わざるを得ない。日本の法律は加害者に甘く被害者の擁護には無関心だ。だから狡猾な犯罪者はそれを利用し、人を殺したり、騙したりしても少年だからと罰を逃れる。司法がやり得な事を許してしまえば、社会の規範など崩壊するだろう。日本はもう安心して住める国では無くなって来ているのだ。",2,1
"皿洗いさせて、この少年には裏方仕事の大変さを理解させることはできても、今現在、またこれから同じように迷惑行為を行おうとしてる第2第３のペロペロ予備軍に対しては何の抑止にもならないよね。ということは被害を受けた店側には何のメリットもない。",1,1
"反省、更生、全て、加害者の利益にしかならない。（漢字をよくみるとわかる）今回の件で、チェーン店よりもっと下請業者は、もっともっと煽りを受けているはず。業界が何億の損であれば、下手したら、潰れた、または、社員に給料払えない下請工場もでてきているのでは？もし、死人が出ていたら、ほぼテロ行為となんら変わらない。加害者の更生を言っている人は、対岸の火事でしかないから言える。もし、自分に銃を向けるテロが子供だったら、撃たれて手足が無くなってもこの子の更生なんていうのだろうか？",1,2
"実際の被害としてはペロペロ少年の投稿だけではここまでの損害にはならなかったでしょう行為自体はあまりに軽率で後先を考えない愚かな行為だと思いますがマスコミがこぞって連日大々的に報道することか？と思うと甚だ疑問ですマスコミが話題として面白いと思って拾ってきて各社一斉に拡散させたマスコミ起こしたムーブメントです株価下落の大きな要因（責任はあくまで少年）はマスコミの報道姿勢にあると思います",2,2
"将来だ更生だはまだ早い、そんな事ばかり言って守ってばかりいるから、未成年犯罪が減らないし反省も形だけで再犯に走る。未成年で殺人犯した自称「酒鬼薔薇聖斗」ですら反省の態度、行動じゃないし決してやった者勝ちであってはならない",1,1
"たった、それだけのいたずらに対してなんでこんな何千万円も罰を！って言いたいのでしょ。言葉を選ばずに言うと、誰かが人柱になって制裁を受けなければ次が出てくる。実際今まで幾度となく出てきていた。その人柱が、彼だったというだけ。彼の犠牲でこれからの馬鹿者が減る。そのほかの店も追随する。客も店も、いいことしかない。いいじゃん、命までは取られないんだから。",1,1
"悪いことしたら裁かれる、それなりのペナルティーを受ける当然のこと。そう言うのを許してたらエスカレートするだけで歯止めが効かなくなる。やり逃げとか、相手は生活かかってるのに舐めたやつには当然の報いだと思う。冗談で済まされない話。",4,1
"某大型掲示板でも庇う人が来てビックリ。まぁ逆張りだと思いますが。我々が安心して外食出来なくした罪は大きいですよ。やっちゃいけない一線を超えたと思っている。だって回転寿司なんて性善説で成り立ってるんだからまさかこんな奴が出てくるとは思わなかったんじゃないの。母親はまだ反省してるって言っててあぁここの親にしてこの子ありと思ったけど一生反省してて欲しいわ。",1,1
"スシペロ少年を擁護するよ。したことは悪い。それもわかってる。でも確実に1人の少年の人生を殺すという選択肢を取ると言うことは忘れてはあかんと思う。企業として加害者に罰を与えるのは当たり前。おふざけを許さない!てのもわかるけど、悪意しかない犯罪者ではないたまたまふざけた少年は十分に日本全体から社会的制裁は受けたかと。。。甘い？？？スシローが今回の事件で店閉めて社員切って、企業的にも壊滅に見舞われたならあれやけど、、、こんなこと言わんけど少しでも情けがあるなら、少年から生きることを奪わないであげて。",2,3
"悪いことをすると天罰が下ると教わって育った俺様が通りますよと！現在の親は、躾しないのか？或いは親自身も躾されずに親となっちまったのか？最低限の躾は、「ひとに迷惑をかけてはいけません！」これって万国共通だと思うが？こんな子供に誰がした？他人様がしたのかな？現在は、悪事千里を走るの世の中！SNSは瞬時の内に全世界を駆け巡る！World WIDE WAVEやめますか？人間やめますか？この辺りを学校でも家庭でも子供達に骨見に染み込ませてやるのが、大人の役目かな？(多分知らんけど)",1,1
"この記事の通り罰を下すのは中立の司法なので、これは私刑でもないし当然の措置なのを、更生させろだの厳罰すぎるだの被害者でもない連中が何故言ってるのか？そんな甘いこと言うからいつまでも馬鹿な親は子供に厳しい躾をせず、子供は大人をなめて平気で犯罪を犯すんだよ。",1,1
"＞下働きについて、具体的には皿洗い、掃除、荷物の搬入などを挙げていた加害者救済のために被害者の店で裏方をやらせればいいって？どこからどう考えたらここまでてめぇかってなセリフが出るんでしょうね、一応識者と言われてる連中でしょう？「皆が面白がると思った」と店や他の客の迷惑になることを平気でやるようなガキを店の厨房に入れる？ペロペロよりもっとひどいことをやる可能性しか見えない被害者に二次被害三次被害を与えたいって事ですか？それくらいならこのガキにやられていやかどうか知らしめるためにも、スシローに金を払って食いに行かせて目の前で唾をつけた寿司を食わせなさいよ自分がやったことがどういうことなのかわかるかもしれないスシローの従業員が、一人一個ずつ唾をつけて全員分を食わせる自分がやったことなんだから平気で食べられるはずですよね",1,1
"この記事を読んで溜飲が下がりました。守られるべきは被害者で、加害者は相応の罪を償うのが当然です。後悔するならやらなきゃ良いだけの話です。悪いことを悪いことと思わない子供、そんな子供に育てた親の責任。一家で一生かけて償うしかない。",1,1
"おかしな擁護論が起きるのは、戦後教育が間違っていたからですね。加害者の人権を不当に高く見る傾向は、悪人も人間だからと言う理屈からでしょう。加害者により被害を受けた方への配慮が無くなってしまっている。因果応報、事業自得を念頭に置いて人生を歩むべきでしょう。",1,1
"まぁ気持ち悪いよね。ネットでは明らかに加害者を批判する声の方が多いのに、テレビメディアやコメンテーターになると加害者擁護や批判しても優しい感じが多い。｢加害者が悪い。損害賠償も少ないぐらい。｣等と批判する場面は見た事がない。顔出しでの意見だから後の批判やイメージのためにコメントしずらいのもあると思うけど、｢加害者の今後の更生～｣という意見が多くて何だかなぁと思う。",5,1
"安いでしょどう考えても。優しいなと思ったよ。犯罪者に優しい日本はここでもだなって感じた。擁護する意味がわからない。何の罪もない人が大勢迷惑かけられて、会社はすごい被害だったろうになんでこんな馬鹿げた行為をしたやつを擁護する気になるのか、甚だ疑問。",1,1
"飲食店が被害を受けたのば事実。きっちり訴えた方が良い。ただ、snsにあげた友人、広めたインフルエンサー、さらに広めたマスコミがお咎めなしなのは納得いかない。頭の悪い子供はいなくならないので、広める側を抑えないとこの種の被害は無くならないと思うのだ。もちろんこれはスシローの問題ではなく、法律の問題だ。",1,2
"ハッキリ言って我が国は犯罪加害者に甘過ぎるわ。自分の行為をYouTubeで公開してる段階で悪ふざけのレベルを越えてる。にしても安すぎるよね。一生かかっても払えないような金額を提示するべき。自業自得だから払えようが払えまいが知った事ではない。",2,1
"安い高い以前にこういうバカども、その親はそもそもカネ払わないし払う気もない場合が多すぎます。おそらく悪徳弁護士が知恵つけてる場合もあるでしょうが、とにかく無視して払わないのはまだいい方、資産隠し、偽装破産など犯罪に犯罪重ねる輩も。必ず金払わせるように、一定期間の資産移動禁じたり差し押さえ前提にしたりとルール、法改正すべきです。",5,1
"この記事制作者、ってドアほうですか？巨額の賠償請求を受けた一次大戦後のドイツが、どうなったのか忘れたのか？それとも歴史の授業は受けていないのか？それだけアホでも大岡越前は見ていないのか？だいたい日本は浪花節の国。　ある程度は損害賠償しないと示しは付かないが、少年の反省ぶり次第では、再度大人な対応、日本人に受け入れられる対応が求められているのだ。",1,2
"悪ふざけなつもりが大問題になった事例でしょう。この家庭がどうだったかはわからないが、親が教えない、注意しない、注意しても子は反発して聞かないという連鎖ではなかろうか。周りの他人が気付いて忠告しても逆ギレされる可能性が高く関わりたくないし、子供、若者でもチンピラっぽさのあるグループならなおさら。(反社会的人物と繋がりがある者もいる)左派的な組織、人は大勢の逆についたりするのでそんなものでしょう。こうなると暫くは人生、進路が上手くいかない。宗教系大学に行き、寺や教会で修行して聖職者にでもなったらどうかな。失敗したが10年後には立派になれるだろう。",1,1
"まあ人殺したわけじゃないんだし社会的制裁も浴びたし多めにみてやれよってことだろうただ会社としてはそうはいかないだろうとはいえスシローの危機管理の甘さはコロナ禍から言われてきたことだからいいお灸になったと部外者感覚では思う",1,1
"加害者は被害者の未来を考えず好き勝手して損害を与えたのに、どうして加害者の未来を養護するのか？未成年だから？だったら親も一緒に罰を受けて本人のためにも抑止力となるような罰を与えるべき。",2,1
"青少年犯罪者の更生？それに行政、立法が筋を通すならそう教育した親に責任を取らせるべきこれも自己破産申請免除として逃げれない様にするのも重要だわ日本の法律はすべて加害者に甘く、被害者に厳しいこれをすべて過去の判例認識捨てて是正すべき",1,1
"ほとんどの奴は勘違いしているわ。アメリカならこんなことで企業側が訴訟しない。この程度のことで訴訟をしてくる「弱い者いじめしている」企業と取られるからだ。逆に、企業側がやらかした「おとり広告」に対して消費者から訴えられるだろうね。ペロペロ事件の場合だったら、「安全性を放置した」と企業側が訴えられるよ。ここのコメントを見ていると、ほんと国民性が出ているね。「秩序を乱すものは徹底的にたたく。」「感情的になる」これって、コロナでもそうだったよね。ベビーカーとかもそうだよね。",1,3
"ほとんどの奴は勘違いしているわ。アメリカならこんなことで企業側が訴訟しない。この程度のことで訴訟をしてくる「弱い者いじめしている」企業と取られるからだ。逆に、企業側がやらかした「おとり広告」に対して消費者から訴えられるだろうね。ペロペロ事件の場合だったら、「安全性を放置した」と企業側が訴えられるよ。ここのコメントを見ていると、ほんと国民性が出ているね。「秩序を乱すものは徹底的にたたく。」「感情的になる」これって、コロナでもそうだったよね。ベビーカーとかもそうだよね。",1,3
"加害者擁護してるような頭の弱い人たちが本当に日本にいるんですか？私は他人の迷惑考えない極めて迷惑で非常識なイチびった輩が合法的に徹底的に容赦など一切無い制裁を与えられるのはより良い日本になるために必要だと思いますし、なにより本当に気分がいいです。それが未成年でもです。知能や知性や教養があり何よりモラルをしっかり持ってる日本人は間違いなく皆同じ意見でしょう。ですので裁判はスシロー満額勝訴が望ましいです。",1,1
"＞いわゆる政治も含め「リベラル」とされる人々が「いいことを言っている」つもりのはずが、これは違うだろう。リベラルだからって、悪いことをやったなら、それなりの罰は与えられるべき、の発想は同じ。リベラルか？否か？なんて関係無く、個人個人の見解でしょ。一括りにするな！と言いたいね。さて、金額設定についてだが、安い金額設定だし、裁判終了後は更に減額されるのだろうけど、望外な金額を請求して、簡単に自己破産されるより、払える可能性のある額を請求して、親ではなく加害者本人が社会人になって以降も払い続ける形をとったほうが良いと思う。親ではなく加害者本人が一生をかけて支払わなきゃいけない、という事例を増やす方が、抑止力になるのでは？ただ、こういう馬鹿な行為する輩に、事例を認識させるのも至難の業ではあるが。",1,1
"そりゃそうでしょう。醤油さしをペロペロしたのなら、実際の損害はその醤油さしを消毒し交換する程度だもの。問題は、１．醤油さしペロペロ２．それを撮影３．それをSNSにUPする４．SNSにUPされたものを拡散する（マスコミ含む）各々に相応の責任が生じるってこと。１だけとれば6700万円は高すぎる。2にしても同類。最大の問題は3をやった者であり、結果的には4が一番損害を与えているのが実態。1の者に全責任を負わせる？それでいいの司法的には？例えが違うかもしれないが、レイプされた人がいたとして１．AにレイプされたB２．それを撮影したC３．それをSNSに挙げたD４．Aを実名挙げて報道したE　（この場合Bはスシロー相当）この場合、EはBが誰であるか分からないように報道しなければならなかった。つまり、スシローという名前を出して報道してはならなかったんだよ。でなけりゃ同罪でしょ",1,3
