comment,like,bad
"皿洗いをしたら許されるって皿洗いは罰なんでしょうか？世の中に皿洗いのバイトがありそれで暮らしてる人もいますがその人は罪人ですか？皿洗いを罪滅ぼしとしてる人は何を思って皿洗いにしてるんでしょか？",3,1
"z世代に今回転寿司のシステムが適合してないのでしょう…。企業側が営業形態を変えるしかありません。これは飲食業に限らず、サービス、メーカーにも同じ事が言えます。人間が変わってしまっているのですから。",2,2
"リベラルの目的は赤軍および人民解放軍の導入だからな自衛隊の形骸化、警察の無力化、国内の混乱を志してるわけよ加害者を増長させ被害者を切り捨てるのは当然",1,1
"加害者は加害者以上でも以下でもなく、擁護する必要は一切ありません。とんでもない犯罪を犯しても、被害者が亡くなったら、加害者を擁護する連中が現れる。曰く更生の余地がある、反省している、更生しなかったら責任とって欲しい、反省してますと言えば減刑の可能性があるから、殆どの加害者は反省してますと言うわな。義父のバカッターも日々反省しているらしいが、だからといって、世の中は1ミリも動かないから。逆に一切反省しない、と言ったら叩かれるだけだからなぁ。やった事に責任持たないと、そういう世の中になって欲しいね。",3,1
"子どもだから何をしても良い。とはならない。キチンと親が普段から良い、悪いを教えて無かった付けが来ただけ。他にも記事に書いているガリ食いなど色々有るけど、そちらも提訴したら良いですね。",4,1
"いや…少年側が今回の損害に意義申し立てて…もう反省しているし謝罪したから…多分外国なら絶対許されないと思うよ。日本独特のシステムを崩壊させた事の重みを何も感じてない。日本人の常識を全て破壊した責任がある。",2,1
"余計なお世話かもしれませんが、撮影者はお咎めなしなのか？飲酒運転も同乗者に罪があるように、撮影者も犯罪行為を助長しているようなものではないのか。",4,1
"マスコミの方針はおかしい。絶対的に被害を被った企業が追及する姿勢を批判的に報道して加害者救済の提案をするくせに、政府がヘマをしていると圧倒的犯罪者扱いをして、提案的報道さてせずにこき下ろす。ここでは被害者救済に全力を注ぐ。報道とは、司法同様フラットな目線で見るモノではなかろうか？今回の訴訟は原告が一部勝訴でも勝ち取れなければ、報道はどう取り上げるのか？似たケースのアメリカで起きる訴訟の賠償額がどれだけ忖度しないか、知ると日本での事がバカバカしく思える。",1,1
"加害者の人生背景などを掘り下げ擁護するマスコミの体制損失額に比べれば安すぎるが、あまりにも高額の請求をしたらしたで企業イメージを下げる報道をするマスコミ大企業のため潰れてはいないが、社員さん全員のボーナスとかにも影響している可能性もありますよね。マスコミの判官贔屓も行き過ぎると良くない典型ですね。",1,2
"長嶋一茂はボンボン育ちで社会知らなあたのに、なに偉そに提言なんかしてんだよって感じました。ま、とにかく、スシローの提示額は安すぎるくらいだ。あの一件で行くのを控えた人が多い（実際に自分は控えた）だろうし。最近はソースなど調味料や箸などセルフで客に提供する飲食店が無くなったと感じる。昨日行ったフードコートの飲食店もソースなどいつも店外にあったのに今は店員が管理して客が要ると言ったら渡していた。売り上げに直結するから他社への影響もかなりあるよね。",1,1
"株価暴落だけでなく、不潔感を嫌いスシローに行くのを暫く敬遠した人も多く居る筈。温情の有る請求額だと思う。頑張れば返せる金額だもんね！",2,1
"他国なら桁は違うだろうが、このくらいのほうが現実的で、人生大打撃、抑止力になると思います。桁が上がると、「そんなん無理やん！」って開き直りそうですね。",80,12
"スシローは「おとり広告」で嘘の広告を打って客を騙し、消費者庁から処置命令を受けてたよな…要するに、自分には甘く他人には厳しいと。そういう会社が経営する店には行きたくないな。",2,1
"裏方、下働き、フロントライン、現場とか力仕事とか、イチイチ小バカにした見方する奴らって何なのか。長嶋なんて自分は明るいところで活躍してると自覚してるんだな。で、その他大勢は裏方なんだよ。何様なんだか、悪気無いようだが根底ではつけあがってる。",1,2
"私は6700万円と聞いて、スシローさんは遠慮したな、と思いました。何十億も要求したら踏み倒されるのは明確なので、一生かけて払える額にしたのかな、とも。",1,1
"少年を悪事に駆り立て、株価に大打撃を与える、欠陥だらけのシステムであるにもかかわらず、何故か誰もがSNS利用者のマナーを求め続ける。ネットがリアルになってはいけないよ。",2,1
"下働きを提案したのを擁護と捉えてるの？　他に加害者を許せというような論調はあったの？洗い物などは立派な仕事だけど、ただ働なら罰だろ。それが更生に繋がるかどうかは別として。",3,2
"スシローは良心的な額で損害賠償を出したと思います。１００％満額請求は無いのが普通なので、それを考えると良心的です。テレビ番組のコメンテーターのお坊ちゃま君が何か言ったらしいが、世間一般の感覚をお持ちではありませんから参考にもなりません。",1,1
"この金額設定の根拠を知りたいところ。加害者の資産を調べての結果なのだろうか。どちらにせよ加害者側が告訴を取り下げよとは反省しているとは言い難い状況になっている。極めて不愉快です。",1,1
"率先して事件を世に広めてきたマスコミが何を言ってるのか…「ネットの炎上」だけに留まっていればここまで大事にもならなかったかもしれないし、加害者の社会復帰への影響も少ないでしょう",2,1
"全く持ってその通り。スシローがここで折れれば今後この手の犯罪が増えるので粛々と進めて欲しい。窃盗を万引きと言って軽いイメージにしているのと同じで、これはもう悪戯ではないのですよ。交通違反を反省してますと言って免除されますか！？そういう事。",5,1
"庇うのなら、１０００万円でも１００万円でも良いから、補填してあげたらいいのに。行動で表そうよ。私は、６７００万円は低いとはおもいますが、放棄しないで払える妥当な額かと思います。",2,1
"仮に、一茂も自分の経営する店が強盗や醤油ペロベロ的迷惑行為に遭ったら、この強盗は組織的な犯行なのか、なぜこんな迷惑行為に至ったのかと言うこの人物の生い立ちや家庭環境や警察には背後関係を徹底的に調べて欲しいですね。とか言うよ。犯人（少年）に皿洗いをとか同じ事は絶対に言わないよ。テレビもネット民も強盗も迷惑行為も結局みんな他人事なんだよだから好き勝手言える自分が被害に遭ったら激怒するって",19,1
"まったくもって同感。なぜ、加害者を甘やかす発言ができるのかがわからない。ＴＶ局だって生放送中に外部から社会的に違法な行為をされたら困るし、怒るでしょう？。同じことではないかと。罪を犯した以上、普段は良い子とか全く関係ない。やったことが全てで、司法の場で裁かれるのは当然のこと。併せて、「被害者が加害者の更生に携わる必要がある」訳ないのもごもっとも。ワイドショーの素人コメンテーターの発言もいい加減うんざりです。",3,1
"あの偏差値低そうな子では普通の仕事してたら返せない額だね。せめて月に手取り40万位有って、実家に居候してずっと小遣い無し、超低金利が続いて35年ローン位やってギリギリかな。",1,2
"お店が受けた被害を考えると相当に低い額だと思います。が、損害賠償額の金利は3%のようですね。670０万円だと初年度は201万円か。資産も売る家も無いのなら一生返せないな。",4,1
">「スシロー」が「罰を下す」ではなくこの記者も某元野球選手と変わらないな。これは「罰」ではないです。単純に損害を受けたお金を返してください、と言ってるだけです。損害賠償＝罰とか言うからややこしくなる。罰なら「威力業務妨害」とかで、罰金と言うことになります。罰金は決して被害者にはいきません。たまに罰金と損害賠償を一緒くたにする人いますけど、この記者さんも怪しいもんですね。",12,7
"今の教育制度では悪い事をしても怒られないので悪い事の判断が出来ない子が多い、こうした悪ふざけを平気でしたり悪ふざけでしかアピール出来ない頭の悪い子が増えているからですよ、厳しい罰を与えない限り無くならないでしょ",4,1
"元プロ野球選手は自分自身は周りからのプレッシャーや苦労があったと言うかもしれないが何だかんだでプロ野球選手になり何だかんだでプロ野球選手を続け引退後には解説者になりタレントで今はご意見番的なコメンテーターでしょ本当に裏方の苦労がわかるのか？疑問",3,1
"とりあえずまだ食い逃げの方が軽いというね。社会的信用に関わる犯罪行為なので桁を上回る賠償が待っているということを想像すべきだった。",2,1
"皿洗い、荷物の搬入、掃除。それを指導･監督するのは誰なんでしょうかね。やって良い事と悪い事の区別がついてない人を1人きりにはできないですよね？誰かが監視しなきゃいけないですよね？それ、誰がするんでしょうね。",2,1
"「他国なら桁違う」は常識です。例えば「キセル乗車」がスイスでは運賃300倍の賠償額と聞いた事があります。世にはびこるトンデモ加害者、それを擁護する者どもにグローバルな常識を叩き込む必要有。",14,1
"だいぶん偏った記事やね。マスコミが加害者を擁護しているとはとても思えないけど。こういった事件は、個人の問題もあるけど、社会構造の問題でもあるとなぜ考えられないのか。",3,1
"なんでこんな阿呆な事した加害者の養護をするマスコミが多いのか、本人がやろうと思ってやった事なんだから覚悟して腹をくくるのが至極当然なのに。何処かの聖人みたく全て許す事が善とするなら、このマスコミの連中は営業していく上で誰かに何かを奪われ、失う事になってもその加害者を許すのかな？そうする覚悟がないなら的外れな加害者養護なんてしたところで記事の信憑性やら信頼性が無くなるだけだと個人的には思うな。其処までして加害者の方を養護したいなら損害賠償額の6700万円肩代りしてあげたらいいんじゃないのかね。",2,1
"全くもってその通り！何で被害者が加害者の更生したらなあかんねん！持論を言うのは自由やで？被害者は未成年やからとか？スシローさんは元々この事件が発覚した当初から法に則って行動すると言っていた。んで賠償金6700万円なんやろ？何一つ問題無い。当事者である加害者、被害者以外は黙ってた方が良いのでは？んで裁判結果が出てから裁判所に文句なり何なりすれば良い。スシローに文句を言う事自体おかしい…そもそもこのペロペロ君のおかげでどうなった？外食産業どうなった？カウンターに調味料置かなくなったりと対策取らざるを得なくなったんやで？俺も何でこんなめんどくさい事なってるんやと思いながら、調味料お願いしたりするようになった…反省だけなら猿でも出来るって文言？を思い出したよ。反省した後どう行動するかやろ？反省したままの加害者側には何も共感出来ません。",1,1
"擁護する意味がわからない子供とか関係ない　しっかり罰しろと実際いくら取れるかはわからないけど示談にはせず出来る限りちゃんと取れるようにしてほしい　自己破産しても意味ないって別記事で弁護士が話してたし一生かけてでも払ってほしいですね",12,1
"全国に展開している全ての店舗で対応を行うとなれば対策のトータルコスト＋イメージダウンによる客足減少の損害=6700万　はだいぶ抑えた金額と思う",1,1
"この件に関して、少年が一方的に悪いと思うが、「客の減少は同業他店との競合も考えられる」と反論していると聞いてあきれた。本当に反省しているのか？6700万円など安すぎる。",1,1
"この記事では加害者を擁護するのはリベラルという論法だけど、そういうのは偽リベラルなんです。不法・迷惑行為をしたら非難され罰せられるのは思想とは無関係に当たり前です。それがいけないというのは悪魔的思考です。",1,1
"擁護しても良い失敗と擁護してはならない失敗を間違えている気がします。日本は果敢にチャレンジして失敗したことを許さない風潮であるにも関わらず、悪意のみの行動に対して擁護するといった矛盾があると思います。",1,2
"「げんこつ一発ですむ話」など、事の重大さを理解できない大人たちによる養護は、SNS、インターネットの威力を理解できない人たちですね。SNSの投稿１つで一企業を潰すことも人の命を奪うこともできるということを理解できない。そういう人は自身がインターネットで発信する際にも自分のこの一言が周りにどう影響するかということを考えられない想像力の欠如した人です。こんなことをしたらどうなるかを想像できない迷惑行為をする人間と同類、同レベルということです。",2,1
"むしろ最大限譲歩してくれてこの金額だろうよ。被害総額から比べたら6700万なんか誤差といっても過言ではないレベル。どんだけお人好しなんだよって思うけどもね。この少年によって被害を受けたのは会社だけじゃないんだよ。その会社で働く、かかわりのあるすべての人、そしてその人の家族にまで被害を及ぼしてるんだよ。",1,1
"単純に高い安いで考えるのはナンセンス支払い能力の無い人に高額の賠償を求めても支払わずに終わってしまうケースの方が多い6700求めて1000とかで収まればまだ払ってもらえるかもしれないが1億ってなったらハナから逃げられるスシローくらいの大きいチェーンで1000払ってもらってもあんま意味ないけど見せしめにはなるくらいの金額その辺のせめぎ合いで金額が決定されます日本は、個人を相手取って賠償で利益が出る国（法律）ではないので基本企業は、泣き寝入りです",3,1
"リベラルマスコミには既存の日本社会体制に不満を持つだけでなく、合法的にひっくり返してやろうと目論む連中が多数存在する。敵の敵は味方、社会に不安を与えるこの少年は彼らにとっては行動戦士みたいなもの。だから擁護する。",1,1
"長嶋一茂の意見をリベラルマスコミ・・・と言うのは無理がありますね(笑)彼にはリベラルも保守も左翼も何もないのだから。ネット世論では圧倒的に「スシロー、グッドジョブ!!」ですね。まあ、民事裁判は判決ではなくて和解が多いから、1/10くらいの金額になるでしょうが、愚かな若者への警告にはなるでしょう。",2,2
"長嶋が「リベラル」なの？　なんかすごい勘違いしているようだ。日本で現在、リベラルというのは規律と伝統を重んじる保守の考え方で、憲法擁護がその典型だろう。マイナカードなど見ても分かるように、現状を自分たちに都合いいように変えたいのは拝金主義の自民党や維新だろう。",1,4
"皿洗いなんかやらされれば、腹いせに唾かけたりするよね。しなくても、お客さんはやってると思うよね。一茂さんは坊っちゃんだから、善意に考えすぎる。",2,1
"多くの声ではなく、大きな声が通る時代になってきて嫌気がさす。特定少数の大声ではなく、不特定多数の多くの声に耳を澄ましてほしい。",94,3
"擁護するなら、6700万円あつめてやったらどうか。スシローを責めるより、そうしてあろんな人が自分のために動いてくれたことを理解する方が、彼のためになるのでは？",1,2
"罪に対する罰は公正に行うべきで、罪を償った後の更正には協力するというスタンスが通常の流れ罰と更正をごっちゃにするから変なことになるのかなと",1,1
"自称リベラルの方々は加害者にも温情や更生をって考えるけど、一般人は被害者が救済されるのかって事が最大の関心事。そこが、リベラルが一般人とズレてる所なんでしょうね。",3,1
"これが元で売上に影響が出たほか、業務オペレーションも変更することを余儀なくされて、マニュアルの変更も急ぎで行ったと思います。",2,1
"リベラルの意味わかってる？？日本の頓珍漢な左さんをリベラルって事にして反証の機会、というか発想を潰そうとしてるだろ。加害者擁護はアウトでも断罪だけ叫んで原因についての考証を全く行わないマスコミってのもやっぱりアウトなんだよ。左野党を見下して悦に入ってるうちに与党がこんなになった日本人はそろそろ色々反省しないとな。",3,1
"株価が一時的にせよ160億円下がっているのだから、多数の方々に大迷惑を掛けたのは事実。賠償請求が6700万円で済めば安いだろう。",3,2
"見せしめにかなりの額の賠償を科さないと、第2、第３のペロペロが出てくる。賠償額の棄却を求めているみたいだが、それを許したら第２ペロ、第３ペロが出てくる。それに、どっかのコメンテーターが３０００万くらいだと言っていたが、かなり安いよ。ほんと海外なら一桁、下手したら二桁違うよ。",2,1
"加害者をかばう輩にはこう言えばいい「わかりました、加害者への請求額を下げます。代わりにあなたが差額を払ってください」と。真に加害者をかばうならそれくらい軽く払ってくれるでしょう",6,2
"順番が逆加害者の将来的なんか後回しだと思う被害者が救われてから考えればいいそれをせず前提から加害者救済を謳うから反発が起きる被害者が救われないなら加害者を救ってはいけないのよ",3,1
"ジョーダンやいたずら心でもやって良い悪いは有ります。他人を不愉快にする行動はやはり毅然とした対応をした方が良いですね…",3,1
"安すぎるな！国内店舗で600店舗強あるんだから、改造対策費で、店舗当たり11万円ってことだろ？そんな金額で工事ができるわけがない・・・少なくとも店舗当たり20－30万円はかかるだろう、そう計算すると単純に店舗の工事費だけで1億-1.9憶、+システムの変更や、実損害を入れれば2億越えでは？至って良心的な請求額だと思うけどね・・・・この額請求されれば、加害者家族は、破産申請するしかないだろうな..これで、阿〇な迷惑ユーチューバーが、再生数稼ぎのための過激な行動が自重されれば、いいことだと思うけどね！媒体会社もこういった過激な投稿は、AIで監視、投稿できない仕組みにすべきだと思うし、媒体会社にも責任があると思うけどね・・・",1,1
"割と利用してたが、寿司ペロ小僧の出現からスシローに行かなくなったこの半年、ワイだけで1万円以上の機会損失をしてると言える6700万円と、完済可能な金額にしてもらえたんやから、家も車も結婚も諦めて賠償するだけの人生をちゃんと送って欲しい",1,2
"ごもっともな意見。SNSを使う人たちは、年齢関係なく自分の投稿がイタズラでは済まないコトを知るべき。これを機に親もそういう教育を、我が子にすべき。",4,1
"この金額で和解しようとするスシローの精一杯の優しさ！素晴らしいじゃないですか！少年はこの高い授業を払って世の中の仕組みを覚えていけば良いんです。",1,1
"寿司ペロはスシローだけではなく「回転寿司」という業界全体にダメージを与えていると思う。6700万円という金額は温情込みの請求額だと気がするけど、それを棄却請求してしまう寿司ペロ一家は何を考えているのか。",5,1
"”請求した損害賠償額は6700万円”だけれども、判決がどうなるかで実際の支払額は違うんでしょう。裁判費用を含め、加害者側に最低でも1,000万円近くは掛かるだろうけれども。",1,1
"今回の訴訟に関する記事で一番考えが近くて腹落ちした記事。この表現、「記者」って感じがする。>>6700万円の損害賠償は満額とならない可能性が高い。それでも、こうした行為を「いたずら」で片付けてきたこの国で、その額は大きい方だ。",1,1
"日本のマスコミは、騒動が起こった時には、トンデモナク掘り起こして、大騒動にするのだが、時間が経ち感情が落ち着くと、手のひらを返しの意見がごもっともだ！的な方向になる。まさしく他人事であり、単なるネタになればいい。という思考そのもの。",1,1
"金額が妥当かどうかは司法の判断で弁護士は額を争うのが仕事それで加害者家族が追い込まれた云々を吐くのは加害者は飲食業界を追い込んだんだって認識が欠落している",2,1
"庇うくらいなら弁護士費用の用立て支援すりゃいいと思う。ネットで庇うのなんて誰でも出来るから特例は何でも後を引くし特例のために各所でイレギュラー対応することで無駄になりかねない工数•金も動くだろう",1,1
"犯人晒そう払い終わるまで　ネットワーク社会で指名手配しよう　一罰百戒　一般予防対策です　スシロー社様の回復お祈りいたします　私の生活圏にスシロー社様ないのが残念です",2,2
"従業員だって生活が掛かっているのだから、少年側もそれを自覚した上で皿洗いをしてあげればよい。",1,3
"最近感じるのは、新聞やTV局などの取材力の劣化と軽薄で単純な思考回路。物事の表面部分しか取材せず、課題の全容や真因を探索することなく、その辺に散らばっているキーワードだけ適当に使う、上辺だけの記事やコメントが多い。",1,1
"もちろん更生も加害側の人生も大事だけどそれより前に償うべきものを償ってそれからじゃないのこの国のマスコミや言論人はおかしいよ　報じられたときから復帰はいつになるのかなんてことをやってる加害側ばかりを擁護して被害側は名前も顔も出されて侵害されまくり",2,1
"被害者をおざなりにして加害者に寄り添ってどうする…ほんまにそれ、今回の件だけではなくいじめや交通事故でもそうだし、加害者の権利なんてまず被害者の権利や立場を先に尊重してからで良い。メディアの偏向報道にはうんざり。",1,1
