comment,like,bad
"スシローさん頑張れ！だいたいが事件の本質は、夕食は家族団らんのはずが高校生が悪友と外食とはお父さんお母さんは無責任すぎる。弁済金もまともに支払う事はないでしょう。その場合家族三さんに厳しい刑事罰を考えるべきです。",2,1
"未成年の若さゆえの過ち。日本でも海外でもそれを許容するのが世間としての前提とはなっていますが．．この行動ゆえに株価が下がり何億円と損失を出した事により、お店側社員には当然人員整理や減給の対象になったり、バイトやパートは働きたくても働けなかったり、その結果生活が困窮し人生を狂わされた人が多数いるでしょう。少年の将来は当然大切ですが、今それによって糧を得ている人たちが困窮する事があってはいけません。その人たちにも守るべき大切な家族がいるんです。おふざけで人が間接的に死ぬ事もあり得るんです。マスコミや情報番組のコメンテーターはそこを踏まえて発言しているのか？",1,1
"罰することと、損害を賠償してもらうことは全く別のこと。罰を受けたから賠償しなくていいなんて理屈は無い。行為を赦すことと賠償してもらうことも全く別のこと。損害を与えた以上、その賠償は当然なのだ。マスコミが加害者をどう擁護したところで、賠償しなくていいという理屈にはならない。",1,1
"結果何が起こったかが問題。誰じゃない。損害賠償請求は当たり前。擁護してる奴らの意味がわからないし、信用出来ないふざけてる。この件で株価が暴落し何億もの損害を被り、不潔だと客足も減った、本来ならやらなくていいはずの対応と対策に追われ、新設するのにまたお金がかかり、頭や胃を痛めた人が本社にも現場にもたくさんいる訳よ。それをどうして分からないのか。この損害賠償額は安いよ。請求しても実際判決出たとき、満額貰えることってほとんど無いでしょ。",2,1
"この報道と事の成り行きが今後の「賠償請求の指標」になるかもよ6700万円でも一般家庭からするとおったまげる額やけどナ対企業に限らず、誰に対しても礼節と思いやりを持って対応すること、あと行動する前に考えることを学ぶ機会になったんちゃうかなSNSから身バレして事の重大さを感じて反省してるらしいけど、ひねくれず、腐らんと、これから真っ当に生きてくれたらなぁと感じる",1,2
"結果何が起こったかが問題。誰じゃない。損害賠償請求は当たり前。擁護してる奴らの意味がわからないし、信用出来ないふざけてる。この件で株価が暴落し何億もの損害を被り、不潔だと客足も減った、本来ならやらなくていいはずの対応と対策に追われ、新設するのにまたお金がかかり、頭や胃を痛めた人が本社にも現場にもたくさんいる訳よ。それをどうして分からないのか。この損害賠償額は安いよ。請求しても実際判決出たとき、満額貰えることってほとんど無いでしょ。",2,1
"この報道と事の成り行きが今後の「賠償請求の指標」になるかもよ6700万円でも一般家庭からするとおったまげる額やけどナ対企業に限らず、誰に対しても礼節と思いやりを持って対応すること、あと行動する前に考えることを学ぶ機会になったんちゃうかなSNSから身バレして事の重大さを感じて反省してるらしいけど、ひねくれず、腐らんと、これから真っ当に生きてくれたらなぁと感じる",1,2
"＞加害者の人権、平等という前提に立つとこれが最大の根本的問題だと思う。日本で「人権」という言葉が重視されるのは、たいていが加害者であり被告人に向けて使われる場合で、被害者の人権は全く語られないという特徴がある。それは、加害者に対しては手厚い「弁護」が用意され、総じて弁護士という人たちが加害者の立場でその罪をかばうからだ。被害者は自力により民事訴訟などで対抗するしかなく、その手間や莫大な費用を前に泣き寝入りしているのが実態だろう。要するに犯罪に遭う方が悪いという信じられない思考がこの国の根本にあるということだ。加害者は真に犯罪を犯そうとしたのではなく、やむにやまれず犯罪に至ったのであって、その情状や背景をしっかり斟酌し、更生を期して扱おうという誠にもって道徳的な考え方がベースにあるのだが、おおよそその対象になりえないような凶悪犯に向けても同じ態様なのは絶対におかしい。",150,2
"日本では何でもこんな感じ。反省してるから寛容な態度とか、未成年だから将来があるからとか。損害賠償なんか請求しないでしないで欲しかったって云うのがマスコミの本音だうね。万事そんなことばかりで中国や韓国、北朝鮮にも遺憾の意しか言えない。政府もマスコミも争いごとを避けるのが第一だと思ってるからね。避けるんじゃなくて解決する道を模索さるのが第一だと思うけど。今回の件は加害者が一生かけて返済すればどうにかなりそうな額だと思う。",1,1
"少年が悪いとは言え、吊し上げにして賠償金まで請求する。それを支持する声が多いい、日本社会はマトモな社会には、私は思えない。反論できない者を吊し上げにしてストレス解消して、自分の現実から逃避したいのだろうが、少年には責任能力があるし、仮に裁判に負ければ、破産処理するだろう。結果、損害賠償を受けても、お金を取られる事はない事が世間に知れ渡り、抑止効果はない。",3,10
"やってはいけないことを、もう充分に理解できる年齢なのだから擁護するのはおかしいと思う。金額が低くても高くても更生はできる。スシローの規模や被害（風評被害も含めて）を考えると決して高くはない金額だと思う。逆にスシローが最初から低い金額だったり、訴訟すら起こさなかったら、世間から「スシローは食の衛生面に対する意識が低い」と批判されてたと思う。",2,1
"本当に正しいこと述べている記事だと思います。加害者を擁護する自称エセリベラルやマスコミは、自身を問題の外に置いて、一見格好良さげな無責任発言をしてるだけです。そのような発言をするなら、自身の財布から被害者であるスシローに寄付でもなさったら如何でしょうか？今回の事件に留まらず、飲食店では同様の犯罪が多発しています。世間への警鐘のためにも賠償請求額は億を超えても良いと思います。",3,2
"この筆者は着眼点が一方的にズレているような気がしますね。未成年者のやったことを、戒めと並行しながらなるべく被害が大きくならないように収めようとする努力がなぜなされなかったのか？故意に大袈裟に騒ぎ立てて被害を大きくしたのは大人たちのうちの誰なのか？その莫大(と主張されている)な損害を全て少年の責任として賠償を求めるのは筋が通っているのか？というあたりが論点なのだと思いますね。この少年が単独で賠償を行ってゆくとすれば、その(税社会保険料差引後の)6700万円分の可処分所得のために、さらに料率を上乗せされた税社会保険料を支払いながら自身の生計を営んでゆかなければならないことになります。そのような事態に経ち至る前になんとかしてやれなかったのか？と振りかえって遅まきながらでもなんとかと考えてあげることも大人の責任だと思います。",2,1
"庇う人には何の利益があるのかはわからないけど、擁護する意見は少数派だと思う。それを大きく取り上げているから、過敏に反応しているだけ。今回のスシローの件は、迷惑行為がどれだけリスクのあることなのかを考えるいい機会だと思う。スシロー頑張れ！！",3,2
"確かに日本の法律は甘い。甘すぎてへどがでるが？しかし損害賠償の額を上げた所で加害者は払えない。数千万円が妥当である。その数千万円の支払い命令が出たとて加害者が払わないと何にもならないし払わなくて済んでしまう可能性がたかい。損害賠償命令にも時効がありそれを過ぎてしまえば支払う義務が無くなってしまう。日本の法律は罪を憎んで人を憎まずの理念である。",1,2
"被害者にも加害者にも片方寄らず平等に、それなら店頭の中にカメラを設置するしかないだろ、カメラは正直にその様子を撮す、これ以上の証拠はないだろう、又店内の客とのトラブルの対策にもなる、何も起こさなければそれで済むし、他に何がある。",1,1
"本人と親が謝罪したが断られたとあったが当然だと思う。世の中にはやっていい事と悪い事がある。何十億円と様々に人に迷惑をかけて謝罪だけてば済まされ問題。海外ではおそらく億は請求されるだろうな。それをバイトさせるなんてちょっと感覚が昭和なんだろうな。",1,1
"マスメディアの報道の在り方について同感です。加害者については、報道規制等があるのかもしれないが、警察関係者からの情報だけだったりする。しかし、被害者についてはプライバシーなんかお構い無しで報道する。写真がなければ、何処からか卒業アルバムの写真なんかまで探し出してくる。亡くなった人には、個人情報保護法は適用されないから、何でもありと言うことか。ちょっと時期が過ぎたら、微塵も触れない。商売の事しか考えていない。",3,1
"毎月10万、一生涯払うこと。みたいな判決出ないですかね。未成年の時期なら親が払えなくもないけど、そこそこ痛い金額。支払滞ったら差押えしてもめちゃくちゃ生活に困る金額ではない。人生残り70年としても8400万。企業側からしたら全然足りないだろうけど、逃げられずに生涯反省してもらうためにはいいと思うんだけどな。",1,2
"いろいろとそれはそれこれはこれ。リベラルマスコミが一緒くたに加害者を擁護するのが悪い。加害者を擁護以前に懲罰を判断するのはするのはマスコミの役割ではない。加害者にも将来が…という論調の行きつく先はいじめ問題であきらか。スシローとしては賠償請求するだろうし(安いけど)、それを判断するのは裁判所、加害者の将来を考えるのはまた別人です。では被害者の救済はどこへ？その辺をマスコミが一緒くたに扱うから、こういう事になってしまう。",1,1
"スシローの件だけではありません世の中の犯罪のニュースでも被害者はプライバシーも自宅も家族仕事なにもかも暴かれさらされまくりで加害者はモザイクかけて保護されます色々おかしいよ日本そろそろちゃんと正しい報道のあり方をするべきです",1,1
"自ら進んで楽しそうにやってたんだから反省なんてするって思えるのかね？少年って…言っても高校生何をやったらダメかぐらい判断できる年。こども扱いなんて良くないよ、それに更生なんてするわけがない。人はそんなに変わらないから。再発防止と被害者を一番に考えないと。",4,1
"個人的にはツイッターなどでこういう行為を炎上させ人の転落する様を見るために『正義の鉄槌』として拡散する輩も罪深いと思っています本来ならばこの少年とスシローの一店舗で済む話だったのを全国の寿司チェーン店にまで波及したのはそういうボヤだった事件を面白いからと大火事に延焼した人たちの問題は言及されないのもおかしな話ではないでしょうか勿論この加害少年の考えもない悪ふざけが問題なのは当然ですが罪の規模をより大きくし大炎上させて少年の人生を壊すというエンタメを楽しんだだけでなんの責任もないのには少し腹が立ちます",5,2
"少年法での更正は戦後､間もない頃の生活の為にやむを得ず犯した罪等での更正機会ではないかと考える｡現代に於いて､更正を期待することは小生は困難っあると感じる｡情報はネットから簡単に入手でき､少年法のなんぞやは知っているだろう｡つまりは確信犯だ｡知恵は悪知恵に､賢さは狡賢く…更正は期待できない｡",2,1
"懲罰的損害賠償が日本で採用されていないことでむしろ有利なのは企業の方では。懲罰的賠償は将来の同様の行為を抑止する目的で課されるものなので個人は対象外ですよ。これが適用されるのならおとり広告のスシローは将来にわたってそういうことをしないように100億くらい賠償させられて当然ですね。",1,1
"これが株式資本主義の総本山、米国だったら、「物言う株主」が原告団結成して、株価の下落による損失を賠償せよ、という訴訟を起こして、何十億円かの請求が認められるところだろうと思います。",1,1
"この記事の通り未成年で更正の余地ありとよく言われるが、本当に更正した未成年がいったいどれだけいるか、更正した人間が具体的に社会にどのように貢献出来ているのか統計で出してみて欲しい。これが低いのならば更正機関の更正プログラムの改善も必要だし、それだけではどうしようもない個人の問題も出せるわけだし、未成年出会っても更正の余地なし。あるいは責任能力の有無としてはっきりさせられる。だいたい18歳と20歳での精神年齢なんてそんなに変わらないはず。小学生ならいざ知らず未成年に甘すぎる",3,1
"ホント記事の通り。何にしても日本（マスコミ？）は加害者を擁護しすぎる傾向にある。被害者の顔は晒して加害者はモザイク。意味がわからん。被害者が加害者の更正の手助けをする必要なんて一切無いし、同情の余地も無い。スシローの賠償請求額は6,700万かもしれないが、株価下落は160億円。そして被害はスシローだけでは無い。スシローの株を保有していた人達にも多大な損失を与えている。これで人生狂った人だっているはずだ。それなのになぜ加害者に同情や擁護しなくてはならない？自分が被害を被っていたとしても同じ様に同情し、擁護出来るのかね？",3,2
"TVや芸能人達は基本的にズレてるし鈍いからこれからの人達は知識や教養はしっかりとした場で自分で身に付けないといけない。そもそも店とお金を払って食べに来ている一般人が被害者である。SNSにアップするような迷惑系は犯罪行為をしっかり自ら提示して全国民に宣戦布告してるのだから捕まえて罰与えるのは当然だし、被害を受けた大勢の人達の事考えたら賠償金がいくら高くても情状酌量の余地もないでしょう。",1,1
"企業側に本当に頑張って欲しい。ノリや遊びでこんなことされたら、冗談じゃない。中小企業なら泣き寝入りになる。菓子折り一つで片付けられる。この件でみんなで学ぼう。「悪いことをすると大変なことになる。」一家離散だってあり得るし、自己破産するということはどういうことなのかも、しっかり知った方がいい。ちゃんと払い切った先にしか、認めてもらう手段はないんだから。そういうことを知らないから、こういう事件が起きるんだ。",3,1
"この記事はこの記事で筋が通っている。一方で、スシローは、誇大広告で随分な詐欺的行為を働いた会社。自分たちの詐欺行為にも、役員一人あたり6700万円の罰金又は報酬減を課していただきたい。少年に厳しくするなら、自分たちの身内にも厳しくあるべき。",1,1
"わたしも長島一茂が発言したモーニングショーを見ました。皿洗いなどをやらせればよいのでは、と言っていましたが、素朴な疑問として「何時間働かせれば6700万円分になるのか？」ということと「被害者であるスシローの従業員と一緒に働かせてお互いの気持ちは大丈夫なのか」が思い浮かびました。海外では公園掃除等の司法判断があると聞いたことがありますが（実際にあるのかはわかりません）、あくまでそれは司法が判断して公共施設で奉仕活動をさせるということで、被害者は関係ないのかと。なぜか被害者が加害者の更生まで面倒を見なければならないのか。これはもっともな意見だと思います。",1,1
"この手の加害者を庇う気にはまったくなれない。再発抑止のためにも、もっと高額な賠償金を請求しても良いと思う。＞なぜ加害者ばかり擁護・・＜誰が加害者で、誰が被害者で、加害者はどんな事して被害者にどんな損失をあ与えたのか・・・・・基本的な事を理解していれば加害者擁護なんてないと思うけど。",2,1
"加害者を擁護して自分を懐の深い寛大な人間だと自負したいのでしょう。自己顕示欲というか、自分を少しでも良く見せたいという気持ちの表れなんだと思います、規模こそ違えども似たような事で自分が被害者になって経済的や社会的信用に影響がでるような損害を受けたらどう思うでしょうね。同じように加害者の事を寛大に居られるでしょうか。",1,1
"＞「下働きというか、裏方さんの業務をやらせるのも一つの手」「少年を育成、教育の観点からも（スシローが更生の手助けをすれば）イメージが上がる」と、少年の更生について語ったとされる件だ。確かに加害者の更正は重要だと思うけど、被害者の補償が不十分なのに、加害者の更正や将来ばかりが語られるから世間の支持を得ないんだろうね。この件に限らず、たとえば犯罪被害者は加害者に賠償請求して勝訴しても、相手が財産を持っていないことが多いので、実際にはほとんど金銭を取得できない。犯罪被害者給付金もあるけど、事案によってはそれでは全然賄えない。もっと高額な金を払ってやればよいという意見があるかもしれないが、財源が税金だから拡充するのもなかなか難しい。なぜ加害者がやったことについて国民の税金が使われるのか、という異論がでるからね。結局のところ、一罰百戒が一番効果的ということになるんじゃなかろうか。",2,1
"そもそも桁違いの賠償金にしたら、払ってもらえるのかな？頑張って返そうという気にならず、最初から諦めてしまいそうな気がしますけど。他の国は回収率はどのくらいなんでしょうか。出来れば、賠償金に回収率をかけて、実際に加害者が払った額を比較して欲しいな。",2,1
"日本の罰則は甘い。犯罪擁護、きっと立ち直るとか、一瞬の過ち、まだ子供じゃない？とかでもすべて犯罪は犯罪。だから法律があるんです。そのときの精神的に責任能力があったのか？って良く聞きます。そんな人は犯罪を犯しません。ないからやるのです。もっと罰則厳しく、二度と過ちを犯せないくらいの罰則や指導は必要です。現代は安易に犯罪に走る人が増えてきています。そろそろ全てをアップデートしないと日本はダメダメ世界一になりかねない",1,1
"正直、億単位の請求をかけてくると思っていました。この金額なら全然甘い甘い。未成年は未成年であることを武器にしてやらかしている面もあると思うし、それが通じないよ、という毅然とした企業さんの態度と思いました（でも安い）。こういうことをかばう方は自分に後ろ暗いことがあるのかなーと勝手に想像してしまいます。",2,2
"6700万なら、まぁ、日本的だよねって、思ってた。例えば、これ、被害を受けたのが、もっと小さな寿司屋とかだと、醤油代と魚代で1000円くらいとか、言われそうwなんかよくわからないけど、損害は、物だけで、それも、減価償却された部分しか認めない風潮があって、現状復帰させて欲しいとか無理だし、必要最低限すら認められない。結局、日本の法律は、何故か加害者ファーストなので、加害者がもっとも得をするのだよね。",4,1
"スシロー側はまだ手打ちとはしていない。更に追加もありえると発表している。当事者で話し合ってる最中。さらには賠償を大きくしても取りきれない場合もある。加害者が返済を諦め亡くなってしまっては賠償もされない。バランスが大事。黙って見てるしかない。",1,1
"いつからだろう？明らかに犯罪・迷惑行為をしているのがわかってるのに、加害者の顔や車輌のナンバーにモザイクかけて特定されにくくしているのは。被害者のプライバシーは晒すのに加害者のプライバシーは保護される。おかしな世の中になりましたね。殺人事件犯しても、責任能力云々とか。加害者・容疑者の人権優先するのは違和感しかない。",5,1
"加害者は1人だが、被害者は損失を被っている多くの従業員です。そしてその従業員の中には、ペロリスト君と同じくらいの年代の子供がいる人もいるでしょう。その従業員達が守られず大幅な減収や、最悪の場合失業などになったら、その子供達の将来も大きく狂うかもしれません。6億でも6000万でもペロリスト君は払えないだろうし、払えても完済は遥か未来の話でしょう。しかし、悪ふざけには大きな責任が伴う事を社会として示さないと、第2、第3のペロリストが現れ被害者が増えます。そういう被害者が出るのを未然に防ぐ為にも厳罰が必要だと思います。",1,1
"以前、コンビニ等でアイスの冷凍庫に寝素べったりする悪ふざけ投稿問題がありましたが、反省を今後に生かす方法も考えていかなければ数年後に、また繰り返しそうに思えます。企業側が気の毒です。",1,2
"未成年に対して更正とか擁護を考えるのは刑事罰。賠償請求（民事）に関しては主役は被害者であり、正当な請求額ならば、それは生涯をかけて誰か（親族も含め）が支払うべき。勿論、支払い能力に応じて分割、金利、期間の優遇はあっても良いが絶対に帳消しにするようなことはあってはならない。日本は逃げ得（支払い能力という）が多く、結果、犯罪（闇バイト問題も振込詐欺の受け子も同じ）の助長となってることをマスコミも良く理解（反省）すべき。かつての未成年だから許してあげて、、、といったかわいい犯罪ではもうないことを国民の多くも感じているのでは？",1,2
"この迷惑動画、海外のニュースでもかなり取り上げられていたらしく親日のYouTuber達がこぞって発信していました。国内のみならず海外の回転寿司チェーン店やこれから海外出店を検討している方々にも少なからず影響を与えているとのコメントが多かったです。未成年に対する処罰は更生ありきで考えることが重要なのは理解しますが、真の償いが先だと思います。自分の行動には必ず責任が伴い迷惑をかけたら償う償わせるということをしっかり示さなければ今後もこういう事案が益々増えそうな気がします。子供も親も社会もSNSの功罪を真剣に考え取り組むシステムを作ることも重要だと考えます。",2,1
