comment,like,bad
"かなり安い金額提示だと思います。実際にダメージを受けた企業としては、信用下落という計り知れない損害と回転寿司というシステムへの信頼性、ひいては、日本の国民性や衛生的なイメージを破壊している。どうせ自己破産するだろうが、それくらいはなんとも思ってないんだろう。私は社会的な影響も鑑みて二億くらい請求しても安いと思っている。",11143,362
"金額の多寡ばかりが強調されがちだが，可能な限り「本人が被害者に直接賠償金を収める」ようにしてほしい。親が立て替えるのが現実的な方法ではあるが，やはり「親に返す」形では反省の心情が逓減されてしまう。何年かけても「自分が被害者に支払う」形の方が，反省の心情がそこまで喪われずに済むのではないだろうか。だから，真に加害者の人生を考えるのであれば，「金額を下げる」ことよりも「時間の猶予を与える」方が大切。「50年かけていいから，社会人になったら毎月10万円を直接支払い続けなさい」とするのが理想。但し，事件を起こしてしまうと就職に大きく影響することも考えると，机上の理想論に過ぎないが。",100,23
"この記事がもっともな意見だ。少年犯罪を見ても、未成年だ更生が大事だとか言って被害者は置き去りにされる。被害者の視点に立った報道は無いに等しいと思います。損害賠償額だって海外じゃ払う払えるは別にしても損失額を損害に見合った額で算定する。日本の裁判所は支払う側に立った減額算定に近いと思います。スシローの6700万円は決して高額な損害額とは思えません、かえって少ない位だと思います。",8055,152
"企業に迷惑行為を行ってSNSで拡散する行為がどういう意味なのか世に広めるきっかけとなるでしょう。某二世タレントが裏方業務をやらせて償わせれば良いみたいな事を言っていたがその程度で許されるなら被害は減らないだろう。家庭内教育も勿論だかスマホ所持に年齢制限が無い以上は義務教育の中でしっかりSNS運用含むITリテラシーの教育を行うべきだと思う。",324,7
"企業や社会が責任を負わせることが、同様の行為を減らすために有効です。テレビなどマスコミでは「学校での道徳教育を・・・」などとピントのズレたコメントがありますが、こういう人間は教師の言うことなど聞きませんし、しっかりとした態度で授業が聞ける子供はこんな事件は起こしません。最近頻発している強盗事件ついても、しっかりと報道し損害を受けた企業は訴訟を起こし、成功の可能性や捕まった時の重大性を認識させて思いとどまらせる必要があります。学校で教えるならば、「軽はずみな行動によって、重たいものを一生背負っていくんだよ」と言う事実だけだと思うのですが、この忠告も残念な子供たちの耳に入ることはありません。",865,16
"先日、強盗致傷で逮捕された19歳の少年は、同罪で7度目の逮捕との報道があった。同情する余地があれば「加害少年の将来も考えて」という気持ちにもなるが、明らかにそれを逆手にとって犯行に及んでいる輩がいる。今後は加害者の将来ではなく、再発や類似の防止の観点で考えていかなければならないのでは？",5155,54
"加害者擁護の論調は気にないくらいにしかないように感じます。本件は特に「人権」が関わることも無いですし、加害者の人格侵害のような事態にもなっていないと思いますので擁護するとしたら「子供の悪ふざけだから」というリベラルとは関係のない「犯罪軽視」の論調でしょうね。6700万円の賠償請求についても高すぎる、という論調も無いですし…他国なら規模が違うのはそうだと思いますが、別にマスコミに左右されて6700万円という金額に落ち着いたわけではないでしょうに。裁判所でどれだけの責任が認められるか、これにより他国との差を嘆くのは有りだと思います。",31,3
"正直昔から悪ふざけはありました。いけない事とわかっていてもそれが面白いと勘違いし皆に見せる。今はそれがSNSに載せる事しかしそれがどう言う事か分かっていない若者が沢山いる。やはりそれを周知する為にも今回のスシローの訴訟はありがたいです。安全安心して外食出来、そこで一生懸命働く方たちの為にも必要な事です",2956,48
"実際に受けた損害はもっと大きいはず。でも、何億も請求したところで、加害者が払える能力があるとも思えない。訴訟費用が高額になるだけ。一方で、見せしめではないが、こういうイタズラ、悪ふざけを防止するためには、損害賠償を請求されるということを世間に周知することも必要だと思う。そうすると、このくらいの金額を請求するのが妥当なのかもしれませんね。",2448,73
"スシローは、本来ならこの請求額でも生ぬるいという感じだと思います。働いている従業員とその家族の生活もかかっていますし、ましてや大手になれば影響はやはり大きくなります。今回の少年に対する損害賠償請求は、悪質な迷惑行為を行い企業に損害を出せば、大きい代償を支払わなければならなくなる事が伝わり、模倣抑止に一定の効果はあると思いますし、これぐらいは当たり前の措置だと思います。そして、保護者共々しっかり本当の意味での反省をした方が、少年の今後の為にも良いと思います。",1887,39
"そもそも加害者を庇い立てすること自体、間違っている。犯罪行為を助長するばかりか、逆に、被害者を追い詰めることにもなってします。加害者はあくまでも加害者。法に則って刑事、民事両面で責任追及されるのが、法治国家としての正しいあり方であろう。",1889,34
"株価とか暴落していたし受けた被害はこの金額以上でしょうからね、全店舗に見直しとか備品の取り換えとか色々あったとも思いますし、未成年だからで許されるならこのような犯罪が増えてしまうと思う、従業員の生活もかかっているのだしこれは単なるいたずらではなく犯罪なんだという事を身をもって知るべきだと思います。",393,14
"未成年だから御咎めなしはありえない。物事の善悪の判断ができない幼児ならともかく、親の教育も含めて人や社会に迷惑をかけてはいけないことくらい分かる年齢のはず。分かっていてやるの言語道断。加害者を守って被害者はどうでもいいのか。加害者には未成年であろうと罪を償い、被害者には損害を補償する。何年かかってでもいいのでこの少年と動画をとった友人も含めて、罪を償わせるべきだと思う。二度とこのような馬鹿げた動画が追随して出てこないことを祈ります。",1207,24
"迷惑動画は目に余るものがある。加害者がどれだけ請求されても被害者の損失を考えれば当然だと言える。しかも加害者は店にはそれ程の損失は出ていないと主張している。法的テクニックだろうが、とても反省してるとは思えない。これからこういう被害が出ない為にも、厳しく対処すべきだと思う。なお、賠償請求額と実際の司法判断による賠償額とはかなりかけ離れている事が多いというのは念頭に置いておいたほうがいいだろう。",937,19
"この少年が訴えられるのは当然としても、撮影した奴も同罪だろうあと、いつもこれ系の問題で思うのが、「プラットホームたるYouTubeは何の責任もとらないのか？」ということ自由に投稿させ、それで収益が得られるシステムを作り、また企業としてそこから収益を得ている以上、一定の管理責任はあると思うがまとめサイトの転載の著作権でも問題になったが、管理サイドも責任を負うべきだろう特に企業賠償となれば、個人で支払いきれるものでも無いのだから",1046,113
"この一件以降、飲食業界は様々な対策をとる必要が生まれました。それこそＡＩカメラであったり、提供システムの変更であったりそれらに要した費用は誰が出しているのでしょう。加害者擁護のリベラルの間抜けどもは自分が負担していない以上、まったくお構いなし。企業が負担し、従業員の給与・賞与に影響が出ているかもしれない。提供価格に反映せざるを得ないかもしれない間抜けはそんなことも想像できない更生を期待するなら、擁護して甘やかすより自分の犯した愚行をいやというほどわからせる方が先。一生後悔するほどの反省があるから更生が期待できる。それがなければ黒歴史あるいは武勇伝として語られる程度になってしまう",609,22
"10億円くらいの一生掛けても払えないくらい途方もない金額を提示されるより、数千万円程度の現実的な金額出された方が、ダメージ大きいな。最低でも設備投資（小物の交換やアクリル板の設置費用）等の負担は必要だろうな。それが数百店舗あるからそれなりの金額は認められるだろうな。一生かけて償うレベルだね。頑張って。",369,14
"テレビは観ていませんが…元野球選手のタレントといえば直ぐに思い浮かびます。下働きをさせれば良い…このコメントには正直怒りが湧きます！特に飲食店での下働き（この表現も良いとは思ってませんが）の重要性も理解してないスカスカの意見です！どれ程、重労働で大変な責任を伴う仕事というのが分かってない人間の言う事ですね！この方の仰る通り海外では恐らく数億円、数十億円での訴訟となるでしょう！私は個人的にはそれだけの事をやってしまった…一生償うべきだと考えます！そして本当に更生出来てると被害側が考えた時に相応の措置を取れば良いのでは！？",629,15
"6700万円はかなり妥協した額だと思います。これで応じずに判決が出ても控訴するようなら、反省の意志無しと見て妥協額ではなく損害額を丸々請求すれば良いと思います。加害者も多額の賠償と思っているのかもしれませんが、妥協してくれているうちに手を打たないと傷口はどんどん広がる事になるでしょう。",463,13
"「なぜ加害者ばかり擁護」となるのも個人の価値観は人それぞれ違うのは承知の事実なのは殆どの人達は理解してると思います。よって今回の事件でも迷惑行為をした悪人に対して個人の価値観が反映されて擁護、批判、どちらでもない人達に大まかに必然的に別れます。今の世の中の価値観では当然悪人に対しては擁護する人達は少数派です。これは善人に対しても必然的に同じで批判する人達は少数派に変わるだです。私の価値観は賠償金は少なすぎるくらいだと思ってますけど。必ず少年でイタズラだし反省もしていて可哀想だから減額しろと思う人達もいることは個人として理解はしますが賛同はしません。",318,15
"私は戦後生まれだが、若い時はほとんどの人々は貧乏だった。好きなものも買ってもらえず、一日わずかな小遣いで満足していた。就職するころは高度成長の入り口で若者には夢があった。働いて買いたいものもたくさんあった。何よりもお金の大切さを理解していた。今の若者は欲しいものは親が与えてくれる。ゲームなどで幼いころから遊べた。そう考えると、日本人が富を得た一方何かをおろそかにしてきたのではないのかと、最近は思うようになった。",433,84
"そもそもこんな社会問題を長嶋の息子に扱わせるほうが間違ってる。社会問題とエンタメを同列に扱ってる。公の電波で何か自分の意見をコメントとして発すると、必ず影響を及ぼす。その責任の重さに理解が及んでるのか？",828,18
"食器の洗浄は洗浄機にかける。並べてレバー下げるだけ。しかも家庭の食洗機よりかなり早いのだ。何の罰にもなりませんよ。やるならお店には関わらなくていいから公園の草抜きとか公衆トイレの掃除とかボランティアやってもらえば。やったことに対して賠償額がかわいそうとは思うけど、模倣犯を防ぐためにも親子ともどもきついお灸をすえる意味でも効果はあります。その後も似たような動画配信ありましたよね。悪いけど店にも防犯カメラ設置して、もし悪事が発覚したらそれを保存して、すぐに警察に相談するとかの対応が必要なんだね。特に団体さんには警戒しちゃうわ。人数多ければ多いほど食べ散らかしとかマナーが悪いもん。",575,168
"株価については、確かに騒動直後に急落したが、翌日には急回復し、今時分では更に大きく高値で推移している。更に言えば、スシローが下落時に株を売却し、損失を計上した訳でなく、保有したままの状況だから、日々、時価で動いている株価の推移の一環に過ぎず、流石に責任転嫁が過ぎるのではないか？個人相手への、しかも未成年に対して、損害賠償の請求額6700万円は十分にインパクトがあるし、スシロー側は容赦ないと感じられるが。抑止力を働かせるという観点からも、スシローの毅然とした対応は支持に値する。",240,25
"スシローの提示額はこの記事のようにかなり加害者に配慮した金額ですね。実際スシローが受けたダメージに比べ請求額は一桁二桁も違うと思います。今後このような犯罪や愉快犯を防ぐ意味でも最請求すべきであったように思います。ただ実際支払えるかというとそうでは無いです。でも犯罪抑止力にはなるのではと思います。",84,2
"更生を大事に思うことと賠償は別問題だと思います。更生は刑事罰としてどう考慮するかであるし、賠償は実際の損害をどう補償するかの民事の話です。犯人と親は、そんなには払えないけど可能な金額は将来少しずつ払いますという姿勢を見せるべきだし、更生を考慮してもいいという影響になり得る。示談の有無が刑罰に影響するあれです。",32,2
"昔とは手口が陰湿になってると感じるのは私だけでしょうか？厳しく育てられた子供が親になり、あんな思いはさせたくないからと甘くなる。気持ちは分からんでもないが、躾と甘やかしは別。何がダメで何が良いのか分かるまで教えるのが親の役目。育つ環境で大きく子供の将来を左右する事を分かっていない人が親になるんだから仕方ないが、厳しく育てられた人の方が根性あるし、良し悪しの判断が出来る人が多いかな。子供の未来があるからと同情する気持ちは全く分からない。加害者を守る風潮はよろしくない。法律で守るのは良いが、個人の感情としては間違えている。平和ボケもここまでくると痛い。",151,8
"いくら少年と言えども、自分のしている事の正否の判断力は、十分にある筈だ。それをおしてやったとなると、どんなに弁解をしようとも自己責任は免れない。被害者が大店舗チェーン店であれば、膨大な被害及び被害額になる。それを損害として、損害賠償を求めるのは当然の権利であると思う。それを不当として、加害者の擁護するのには、疑問を抱かざるを得ない。6,700万円と言う損害賠償請求は、安く設定されていると誰がみても分かる事だと思う。被害を受けた方にとっては、以後の店のイメージや運営を考慮した請求額だと思う。",13,2
"スシローやかつやによく行くのだけれども、近年わさびやカラシの小袋化が進んだ。めちゃくちゃ面倒臭い。だけじゃなく環境にも優しくないし、小袋に少し残るフードロスも深刻な問題ではないかと思う。ちょこっとふざけただけなんかもしれない行為が社会に対して、ひいては地球環境に対して、どれだけの影響があったのか、よーく考えて罰していくべきだと思う。個人的には一兆円くらい払わせたいけど、生涯通して払える額で考えれば一億円くらいは払わせてもいいと思う。",112,7
"この賠償請求はかなり安いと思います。スシローをはじめ食の安全の気をついそれなりの投資をしてきたお店は多いと思います。それを一瞬のうちに瓦解させた罪、それもいたづら心で。どんな言い分も通らないと思います。まずは、速やかに賠償責任を果たすべきで、加害少年の更生もやはり親が負うべきものでしょう。外野は四の五の言わずに、見守るのが一番だと思う。",29,2
"日本という国からすれば、高い損害賠償請求だろう。とはいえ、過去の判例で照らす裁判で、どれだけの金額が認められるかは分からない。現実のところ、それほど高い金額になるとは思えない。また、高い金額が認められたからと言って、被告側は自己破産するだろうから、原告側企業がその金を受け取れるとは思っていないだろう。むしろ、企業側は高い金額を請求することで、社会への抑止効果を狙っているとしか思えない。",21,2
"億超えなかったのが、不思議なくらいだと思った。株式市場に及ぼした影響を含めれば、事件発覚当時の下落から現在戻した株価は知らないが、当時の株主や信用買い（人によっては損切・ロスカットの下落？）してた人らからすれば、たまったものではなかっただろうね。コロナで公衆衛生が騒がれてたのも何も役に立っていないし、店の努力を踏みにじる行為でもある。こういう人間に皿洗いとかしてほしくはないし、食材もまともに搬入して保管するかも疑わしく思う。未成年だから大丈夫とかいう考えや、未成年の将来がとかいうけど、甘えを残すから軽微なものでも後を絶たない。被害者に対して加害者が平等という立場が与えられるのも如何かとは思うし、やったもの勝ちみたいに感じて違和感がある。被害者が妥協するとか犯罪助長にくらいしかならないよ。分からないから刑が下る。分かってるなら刑を受けることもない。それだけの事じゃないかな。",55,4
"日本の現状は、若い人たちの犯罪が増えていると思います。法律の抑止力が弱すぎるのと教育の崩壊が原因と感じる。加害者の擁護など必要なく罰を適切に与えその後に更生する道を与えるぐらいであれば理解できる。若者を教育する先生の立場を強化することと新たな良い人間を育てる教育方法が必要と思います。法律や政治を現代にマッチするよう改革が必要と思う",26,6
"これが自営業のお店だったら、潰れてるだろうし最悪一家離散にもなる話やった奴が悪いのに何故責任を軽くしようとする？被害者がそれは決める事だし、実被害から見ても桁外れの請求はしていない。やって良い事と悪い事が有るそこはしっかり責任を取らせるべき",327,9
"実際は、こう言う業界は皿洗いは人の手よりも「自動食洗器」がやっています。この少年の出来る仕事は、ほぼありません。そして、もう一つ現実的な話が、一応、企業としても少年側に6700万円プラス諸費用が支払えるとは思ってはいないでしょう。懲罰的に、司法で裁き、この語、模倣犯などが出ないなどの予防的措置かもしれません。もしかすると、示談金か何かで解決は出来たかもしれません・しかし、今回は、最大の要因に「株主」の存在があるのではと思います。160億円ものの莫大な株の損失を出してしまった今回の事件は、株主が黙っている訳がないと思います。少年の犯罪とか謝罪とかは別として、企業側の株主への責任も問われていると思われます。もはや、後には引けないほど、事件は大きくなってしまったと言う事です。",17,2
"飲食店では搬入の仕方（原材料の鮮度を保つ為素早く、また破損しないよう丁寧に、尚且つピーク時にどこに何があるのかパッとわかるよう取りやすく…）など本当にプロの仕事です。それが生鮮を扱う寿司屋なら尚更でしょう。そして皿洗いも重労働です。衛生検査では洗浄後のトレーなどの残留菌を調べる程、大切な仕事です。そんな生半可な仕事ではないのです。",48,1
"スシロー自身も結構あくどい商売をやっているので、全く好きではないが、今回の事件は他の回転寿司チェーンや飲食店にもかなりの負の影響を与えているのは間違いないので、賠償には応じるべき。いくら未成年とはいえ、そもそも今回の行為に至る発想が異常であって、他の同じようなことをやっている連中に対しても抑止力とすべき事件。現場で働かせて償えばという甘ったれた声もあるが、それを引き受ける現場は無駄な仕事が増えるだけでたまったもんじゃない。仕事はボランティアじゃない。しっかりと賠償金を償わせるべき。",9,1
"スシローと少年の間で訴訟が起こされるのは当然で、そこに未成年かどうかは考慮不要だと思います。ですがあくまでスシローと少年の問題であり、周りが騒ぎすぎだと思います。スシローは高級レストランではありません。こんなことはいくらでもありえるし、本当に衛生的な店を求めるなら高い店に行くべきです。安いお店にも高いレベルの衛生を求めるのが日本の良さでもありますが、お店や安い時給の従業員の負担にもなっています。",11,47
"この事件の後模倣犯が色々出ている。目には目を歯には歯を、最近の日本社会は甘すぎるので、こういう輩が出てくると思う。北朝鮮とまではいかないにしても、厳しさを社会全体で認識すべきだと思う。こういうことをやればどんな事が待っているのか、社会全体に広めていく必要があると思う。",12,5
"飲食業を経験した身としては、今回のような対応は適切だと思うし、むしろ今まで出来なかったというのはあります。禁煙の店で隠れて吸ってる大人もいたし、1人で来てオンラインでぎゃーぎゃーやってる人とか、卓上調味料を出すだけ出して使わないような人も居ました。程度はそれぞれですし、注意してその場ではやめさせても、結局そういう人は他でもやるんですよね。今回はネットで情報が拡散されて会社対少年と世間的にも注目されていますが、出来れば裁判の結果まで公表してほしい。軽い気持ちでやった事がどれ程の罪なのか、社会的に知る機会になってほしい。",5,1
