comment,like,bad
"In addition to the usual club activities such as baseball, soccer, tennis, etc., I would like to see the spread of club activities that are useful for the future, such as programming, an English-only environment, and learning business and finance, for example.",3,1
"School teachers are really busy. It is essential for future children to have good teachers who are energetic and stay. Not being tired or overworked is the light for the future. Not that club activities are bad, but we should think about teachers' work. I want them to move to the community for a brighter future.",13,2
"I think this is a necessary trend, but my nephew's soccer club had to spend 80,000 yen to buy a set of uniforms when he joined, and with all the talk of child poverty, I hope that sports opportunities are not taken away from children.",2,1
"Let's think about it from a student's point of view: school lets out after 3:00 p.m., and you can be active as a club member from 3:30 p.m. at your current school. If you are a high school student, you can stay active until 6:00 p.m., which is 2 hours and 30 minutes. There are about 20 club activities available at schools, so there are many options and students can easily participate. However, what do you think? When it comes to the regional transition, the majority of students usually begin to gather at the base location after 5:00 p.m. Because the leaders do not gather until 5:00 p.m. Even if we start at 5:00 p.m., it will be 7:00 p.m. in two hours. If you go home, it will be 8 pm. This will interfere with the study. First of all, there is nothing more annoying than having to go to another location. It must take courage to work among people you don't know. Not many students would be willing to go that far. It may not be enough to halve the current number of students. Many youth will stay at home. I am convinced that school activities for students will be greatly reduced and many experiences and developmental problems will occur.",14,47
"I can understand that clubs that are originally organized by a single school cannot operate due to a lack of members, but I still think that clubs should operate on a school-wide basis. If there are local clubs for baseball, soccer, swimming, etc., as an extension of lessons, I can help, but I do not agree with throwing all individual sports and liberal arts activities into the local community.",6,31
"Since teachers are not paid for the time they spend involved in club activities, it is unreasonable to hold them responsible for their management. The only way to avoid this is either to consider club activity instruction as part of their job and pay them a reasonable wage, or else not require them to be involved.",4,1
"I agree with the elimination of school-based clubs, but clubs also incur operational costs. I am opposed to a policy that only those who can afford the club fees are allowed to participate in activities, and I hope that this policy will not become a system that discourages children from doing what they want to do.",2,3
"> On the other hand, it has been pointed out that the financial burden on parents may increase due to expenses incurred that would not have been incurred if the club activities were school-based, such as fees to instructors. Since this kind of recognition was behind the tacit acceptance of the burden on teachers in the first place and was left unchecked until it became a social problem, it is nonsense to talk about the burden on parents. If club activities are to be conducted with the recognition that they are part of education, I think the only way is to have specialized instructors and subsidize them.",2,1
"I can tell you from my own experience of having my own child on an out-of-school Jr. ski team that it was very good. I had my own child on a jr. ski team outside of school and it was very good. Being outside the closed world of school made my child realize that there is a different world out there. I think this is also useful for the formation of human relationships. Especially for children who are struggling with bullying and other human relations issues, it will give them a place to escape. The junior high school also recognized it as a club activity. This was 15 years ago.",1,1
"Considering teachers' time, etc., I agree with the idea of separating club activities from the school. However, why is it necessary to have them outside the school?",1,1
"I am of the ""Ala-return"" generation. When I was in junior high school and high school, there was an atmosphere in which it was natural for boys in particular to join some kind of club activities, especially athletics, and participate in them seven times a week. It was even openly said that children who did not participate in club activities were seen as strange and that their lack of cooperation would affect their internal examinations. The actual coaching was really painful, with teachers who didn't know much about athletics, telling us not to drink water, to run, and other such gut-wrenching advice. I am hoping that things will finally get back to normal. If the children want to participate, all they have to do is pay a reasonable fee to a specialist who can give them scientific guidance. The school facilities can be rented if available, but maintenance fees should be charged. Insurance premiums should also be paid by the beneficiaries, not by the school, in case there are claims of liability in case of accidents. There is no problem for children who go home, and the school should distance itself from club activities from the standpoint of fairness.",2,1
"The Ministry of Education's stance that ""club activities are not part of the Courses of Study. The stance of the Ministry of Education, Culture, Sports, Science and Technology (MEXT), that ""club activities are not part of the Courses of Study, and teachers are responsible for advising club activities on their own initiative,"" is making a mess of this issue. Unless the MEXT changes its ""we don't know"" attitude, there will never be a solution to this problem. Many seem to be of the opinion that it should be moved to the community, but where? What about the leaders? What about money? There is a mountain of problems that are completely unresolved, and in the end, the club activities will continue to exist ""with the goodwill of the faculty.",3,1
 ,7,2
"I agree with the elimination of club activities from schools. If you want to play a specialized sport outside of physical education, you have to pay to be taught. The same goes for cultural disciplines. That is not the role of schools or teachers, nor is it something that should be done with taxpayer money. Who in the world is going to benefit from spending taxpayers' money to get serious instruction in their favorite sport for free, and then complain if it's too tough and seek responsibility for it? It's not right to lavishly pay for a cram school and not pay for self-serving sports activities.",15,1
"If you really want to reform the work style, you should increase the number of regular teachers and reduce the number of students per class by reviewing the Courses of Study rather than transferring club activities to local communities. The most important thing is to reduce the amount of unnecessary paperwork and report writing. If possible, a flex system should be implemented so that three or more advisors can watch club activities in cooperation with the school community and the private sector, and the requirements for the allied team should be relaxed to address the shortage of club members. MISTAKE.",8,13
Club activities in schools should basically be abolished and shifted to activities in the community. We can foster a new educational industry to take on both arts and sports. This would have a positive impact on employment and the economy.,7,1
"I think schools should hire outside instructors. If leaving it to the community = no wages, it would be so-called ""exploitation of the worthiness"" and I do not think this is an appropriate response. There is a situation where the need for a neighborhood association or PTA is being called into question, so I don't think the community has enough people with that kind of extra capacity.",2,3
"As a family member of a teacher, this is a serious issue. Please separate club activities from the work of teachers. My son is now an advisor for a club he has no experience in, and he has to work every weekday and weekend without a day off. I wish I could use the time taken for club activities to prepare for classes and for my personal life. Please free the teachers who are working over the line of death from overwork from club activities.",21,3
"I guess it depends on the school. For public elementary and middle schools where students go to a certain school district, I think local guidance is fine. However, in private schools or high schools where students commute by train from multiple areas, it would be difficult to work with students from the same school, so it would be good if we could use the school as a place for activities or invite instructors.",3,1
"I think the question posed in the article is based on the premise that it will be phased in. However, I believe that club activities may be cut off suddenly at some point. TBS NEWS DIG reported on May 10 that ""As of the opening ceremony in April 2023, about 20.5% of vice principals and vice principals at elementary schools and 25.4% at junior high schools said there was a shortage of teachers"" at their place of work. We also distributed a video stating that ""the teacher shortage will become more serious as the second half of the school year progresses due to an increase in the number of teachers taking maternity/paternity leave, sick leave, and other leaves of absence. Not being able to teach classes properly is a big problem. Resolving the teacher shortage is the most urgent priority of the Ministry of Education, Culture, Sports, Science and Technology. The Ministry of Education, Culture, Sports, Science and Technology (MEXT) listed club activities as one of the ""duties of schools that do not necessarily require teachers to take on,"" in the ""Special Subcommittee on Workplace Reform in Schools Document 2-1"" on February 8, 2008.",24,2
"Faculty. It is written as follows. On the other hand, it has been pointed out that the financial burden on parents may increase due to expenses that would not be incurred if club activities were conducted on a school basis, such as rewards for instructors. In addition, there are issues such as the inability to secure a place for activities and the lack of outside instructors who can interact with the students. ↑Here is the answer. In other words, if the teachers were allowed to do it, there would be no cost, no increase in the financial burden on parents, a place could be secured, and there were leaders (amateur advisors in name only). This is proof that the burden was on the school. It is obvious what would happen if we shifted this from the school to an outside party, and we have to get them to agree to that. I am prepared to argue with you. If you can't do something, don't do it. If the development of the sport stops, I don't care about that. Those who can spend the money should do it on their own.",43,4
"You say ""diversity education,"" but if we move club activities to the local area, won't we only be able to do activities where the leaders are close by? That's a contradiction, isn't it? It sounds like the message is that it is okay for all but the major club activities to disappear. What is the difference between outsourcing club activities on holidays and supervising club activities outside of work hours on weekdays? Don't they require the same allowances? Or should club activities only be on holidays?",5,1
I am the wife of a teacher. We don't have weekends off because of club activities on weekends as well as practices and practice games. It is very hard for my family to have children and no weekends off. So I hope that the transition will be regional and that we will have weekends off.,18,1
"Ours is a swimming club. Originally, we were mainly a club, and we only go out under the name of the school for competitions. We have an advisor, but he doesn't give us any guidance, so it's fine if the activities themselves are transferred to the local community, but...in this hot summer season, the best part was practicing in the school pool, but now the use of the pool for club activities is banned! What the heck! We can only be in there for a net of two months or so, and because there is no advisor to monitor it---you were never there in the first place! I would like to see the school facilities such as the grounds, gymnasium, music room, etc. transitioned in a way that students can use them as they are.",1,13
"When you transfer the club activities to the local area, how many people are there who have ""unquestionable character, leadership ability, and performance"" for the students and their parents? For example, if the school is a very advanced school, the school (principal) who facilitated the transfer must be responsible for the transfer if there is no guarantee of the person's character, so it is difficult to find someone... If it is an athletic club, the reality is that there are not even half of the people expected by the public who can properly instruct students in terms of exercise physiology even if the students' exercise level is low.",5,1
"I think that a community sports club format away from the school would likely result in an unmatched number of crimes. Even if it doesn't go to the level of a crime, there will be problems and students may get involved. I can't tell you how many cases I can easily imagine.",1,9
"I think it is a good idea to ""shift club activities to the community,"" but it is good for places with human resources and facilities such as urban areas, but what about rural areas where there are no human resources, no facilities, and no adult clubs or organizations? As is always the case, what the government officials (in this case, the Ministry of Education, Culture, Sports, Science and Technology) think is just an empty theory on paper. About 30 years ago, I submitted a report to the then Ministry of Education proposing the use of local human resources in school club activities, and later I put it into practice at a junior high school in my area, and the junior high school went on to win a prefectural-level track and field championship. It's too late to start talking about it now without doing something about it then.",7,2
"Before we talk about transitioning club activities to the community, the school is using too many volunteers (although there will be regional differences). You should consider offering compensation for any and all volunteer activities that schools are using! And they should also reward the leaders of club activities. It is not only schools that are understaffed. And there is no one nowadays who doesn't have to work, young or old.",2,1
"According to the Ministry of Education, ""Advisor is not a job."" Therefore, there is no advisor allowance, no overtime pay on weekdays, and less than the minimum hourly wage for chaperoning on weekends, but if there is a problem, responsibility is taken and punishment is imposed. And now, about half of all bullying incidents occur within club activities? While acknowledging its effectiveness, unfortunately, club activities have become a stumbling block to school activities. Since the Ministry of Education was able to exercise its strong authority when renewing licenses, why not abolish club activities altogether with a single word from the crane? The Ministry of Education and the committee talk about ""utilizing the private sector,"" but now is the time to give club activities to the private sector and have students who want to do after-school activities pay for them, just like cram schools and swimming. Students who cannot afford to pay cannot do so, but that is inevitable in Japan's current economic system. When I think about how many working hours have been devoted to club activities for free by teachers all over the country, the current situation makes me cry something, but it's time to go to the end of the line. It's time for this industry, which is beaten to death by the public for having so many insane ones, to start having a work schedule that is as sensible as the rest of the world's.",11,1
"I think we should change the name of the club activities already. Basically, students go home after school. If people want to play soccer, they can go to this school, and if they want to play baseball, they can go to that school. So, if people want to play soccer, they can go to this school, and baseball to this school, and so on.",4,1
"If you want your child to take sports seriously, you need money and of course cooperation from the family in the absence of a coach. I think it is too selfish to say, ""I don't have time at home, I don't have money, but I want my child to play sports as much as possible, so I want him to do it at school. But if you want your child to play sports as much as possible, you are being too selfish. If you really want your child to participate in club activities, you have to be willing to be a leader for free. I think you have asked too much of the school. It's only going to get right from now on.",5,1
"It should be transferred to the community. There has been an example in Toyonaka City, Osaka, for quite some time. It's not a quick solution, though. There are many lonely seniors. (Urban areas seem strange.) ・ Excessive workload of teachers. Excessive workload of teachers. The excessive amount of work by teachers. I have talked to a temple whose ancestors ran a temple school. Work styles and local communities are changing rapidly, but education takes time to change. The Ministry of Education is not well versed in political power, and the politicians don't really understand the effects of their investment. School education has not caught up. These things are quite linked. Overall, we should focus on the community.",5,1
"If it's a brass band, they need to change the eligibility for the competition. ......... There is such a thing as a joint team in high school baseball, but preferably on an age basis like a soccer club team. Also, they need to remove the limitation of conductors to teachers, students, and alumni.",3,1
"If it's a community transition, the school doesn't have to dictate or pay for it. Instead, the children's after-school time should be considered their own. No more homework and assignments, let them complete their studies during school hours. No more club activities, so more make-up classes and assignments! I would like to see a total ban on such things.",1,4
"I am a high school teacher and from the bottom of my heart I want club activities to be eliminated. I did not become a teacher because I wanted to be involved in club activities. Without club activities, my overtime hours would be cut in half. I am considering changing jobs because I don't like club activities.",72,8
"So the regional transfer is not free, right? And the salary is 1,000 yen per hour? That's no way to make a living, and it's no way to get good instructors. I think it would be better to pay the teachers for that. I think they would take the initiative.",2,7
"I think it's a good thing - parents won't be giving money to teachers in secret anymore, there will be fewer people who want their kids to be regulars and take a skin in the game if they're not good enough, and there will be more talks that can be challenged by players representing the surrounding community, not the school unit.",4,2
"Children, parents, teachers, politicians, and various education experts will not come to a ""all sides are good"" conclusion. From the perspective of children and parents, it is natural that they would complain, ""Why should the services that I have received for free so far be cut off now, at this time, for my own child? From the administration and politicians' point of view, it is a debate they do not want to be involved in. From the teachers' point of view, they will feel that they were forced to put in the time and effort to make their personal lives miserable. However, Japan is a country with a special language, and human resources have not flowed out to other countries even in ""unfavorable working conditions."" Even the law that says ""only educational public servants are treated outside the principal's order with a fixed overtime rate of 4% even if they die of overwork"" has been in place for 50 years, which is impossible in light of international human rights standards. In the end, there are parents who do not want to lose their vested interests, politicians who do not want to change the status quo for fear of losing votes, teachers who are getting tired and quitting, and young people who understand this situation through visualization on SNS and avoid teaching. And this is before the dissolution of the organization. Nothing will move.",8,1
"Thank you, teachers, for volunteering your time until now, even on weekends, sacrificing your family and your own time. From now on, the local community will take care of the children's education free of charge. There is no one in Japan who can afford to say, ""From now on, I will take care of the children's education in my community free of charge.",13,2
"The Junior High Federation, High School Athletic Federation, Koya Federation, and XXX Federation (where XXX is the name of the sport), these organizations have a splendid hierarchical organization that permeates elementary, junior high, high school, and university schools throughout the country. The advisory teachers of the schools are in charge of collecting mysterious money called ""affiliation fees. In other cases, such as judo clubs, each athlete must pay an amount in excess of 20,000 yen in order to wear a black belt and participate in competitions. In other words, there are concessions there. In addition, teachers who can contribute to these organizations are sometimes provided with a career path. It is only natural to separate club activities from schools from the viewpoint of ensuring a healthy working environment, but the above-mentioned people will not allow it. It is a fact that, like politics in this country, the people in power who do not want to give up their vested interests are delaying the solution of all social problems. Does the Ministry of Education have the will to take a big bite out of the problem?　Impossible. They are probably stalling and watching as society's interest in the subject diminishes and club activities are reduced due to the declining birthrate.",4,1
"It's funny because the club team takes the name of the school. Since club activities are activities outside the educational curriculum, I think we should abolish all of them and start up the most as local teams. If a community cannot do that, I think they will have to give up.",22,5
"I have been involved in middle school club activities for 10 years, and I feel that when outsourcing, only the good kids are used in games because the teachers no longer supervise them. The teacher will try to use everyone who is good in the games and keep the parents and children motivated, but if it is outsourced, I feel that the less athletically gifted children will be disrespected in order to build a strong team.",1,1
"I thought it was a good idea in terms of reforming the way school teachers work, but I'm having trouble with the swim team coming to the local sports club on Saturdays and Sundays and taking over several lanes. Even for free, there are many times when they are not available for sports club schools or other programs for adults.",2,2
"Raise the salary that clubs can get! On top of that, those who want to do it can do it, and those who don't want to do it don't have to do it. That is the best. People complain because there is no guidance for club activities in the school, there is no homeroom teacher, and it happens that they enjoy themselves but get paid the same.",3,1
"I am very sick of the sense of discussing human rights violations in terms of merits and demerits. Do you consider the merits and demerits of bullying? Do you consider the merits and demerits of racial discrimination? Do you consider the merits and demerits of forced labor? There is no room for such considerations. It's all ""absolutely not"" and that's the end of it. Club activities are a human rights issue.",19,4
"I am a parent of a child who plays sports. I don't think it would be good educationally if the result is that they leave sports. School facilities should be made available for use (I think this is the most important thing). The government should pay rewards to instructors. The government should take the helm and not leave it to the local communities! If everything is going downhill as the population declines as a nation, the future of Japan is bleak.",1,2
"It is a good thing to move to the region, but how much does it cost and why are teachers now doing club activities almost for free? If there is enough money to move to the region, let's start by paying for the club activities.",9,1
