comment,like,bad
"I am a middle school teacher. I feel that there is a need to transition club activities to the local area. There are so many areas for improvement: the number of students is decreasing year by year and many schools are not able to form independent teams, teachers are overloaded with overtime and not paid for it, and relationships with student parents are deteriorating because they are assigned to club activities in which they have no expertise at all. However, there are many municipalities that do not have leaders in the community. I think we should secure instructors even if it means some burden on families.",1170,149
"I am the director of a large sports facility. Recently, a basketball tournament for high school students in the prefecture and a table tennis tournament for high school students in the city were held. The teachers in charge arrive early in the morning to prepare for the tournaments. The tournament ended smoothly and without trouble thanks to the advisors' appropriate management and control of the players. Watching this, the staff and I discussed the fact that it would not have gone so smoothly if it had been local leaders instead of the teachers. For now, the goal is to separate the club activities from the teachers, but I am convinced that if we do not proceed carefully, trouble will occur one after another. I am really impressed with the work of the advisory teachers. I think it is really important that many students are guaranteed opportunities to play sports, but I think that the administration and committee members should study the field more carefully so that they do not give up on the project based on a desk plan.",282,129
"I think we have come to a conclusion as to whether we should continue to choose the path of ""no more people becoming teachers"" or the path of ""separating club activities from schools"". The state of affairs in which so many long hours of work have been performed by teachers for free until now is abnormal. We should start over from a clean slate and rethink who will be responsible for cultural and athletic activities for children and how costs will be shared.",785,48
"I agree in the sense that it will reduce the burden on the teachers. I think that teachers who wish to continue teaching should be allowed to do so, but they should be paid well, including new community instructors. Relying on volunteerism with no pay or low pay is irresponsible, and I think it will create new problems. (Not only this issue, but anyway, Japan should increase its budget for child-related activities much more.) I suppose there could be a form of transition to a comprehensive regional sports club like in Europe, but I think it would be difficult to do so immediately, so I think it would be better if the national government makes a plan and the transition is made in stages.",113,7
"Myself, I was a part of the school club activities. As for my children, they were heavily involved in local clubs, but they also participated in school club activities. This was because the school did not have the club activities that my children wanted to do. In the area where I live, there were 7-8 classes per grade when my child was in junior high school, but now I hear that there are only 4 classes per grade. I do not know the details, but I think that the number of club activities is also decreasing. I feel that the time has come to separate extracurricular activities from school in order for each student to engage in what he or she likes to do. However, this requires proper budgetary treatment. We think it may be time to switch to paid community clubs instead of free school club activities.",672,83
"I feel that only elementary and junior high schools are being promoted after the regional club activities. I would like to see high school club activities promoted more quickly as well. Club activities are voluntary activities of students, and there are teachers in the same workplace who want to provide guidance and teachers who do not want to provide guidance. Teachers who don't want to lead club activities sacrifice their families on weekends to lead club activities and organize games. Is this a terrible thing? At the end of the school year, the administration asks for advisor preferences. I would like you to listen to the opinions of those who do not want to be advisors. I would like you to give them to the national government or the Board of Education.",622,67
"I agree with the transition to the community. I would like to see lifelong sports, lifelong music, etc. promoted like club activities for all community residents, including adults, rather than separating them by age groups of elementary, middle, and high school. If there is a place where people of all ages, including children after returning home, adults after work, retired elderly people, and people with the same interests can gather and be active, I think the community will become more energetic and the educational capacity of the community will be enhanced. There are many people who could be saved by moving to the community, such as children who quit sports they have been following because there is no club they want to play in at school, teachers who are national-level kendo players but are forced to become advisors for the volleyball team, and adults who played in a brass band during school but cannot continue after getting a job. With the declining birth rate, it is expected to become increasingly difficult to compete and perform in group sports.",128,16
"The challenges are very many, but I believe this is the direction we should be moving in as we look to the future. Now that our children have grown up, we can afford to look back. Although the origin of this trend may be the elimination of overtime work for teachers, it has been a long time since the declining birthrate has made it difficult for schools to compete in athletic games and cultural club competitions. The unique Japanese culture of club activities, which is based on the assumption that the population is expanding, is very unique from the perspective of other countries, so we should not take the current situation for granted.",321,34
"Elementary school youth sports club activities were originally separated from the school. Junior high school club activities should be done in the same way. In youth sports clubs, the parents find the leaders. There is no way to have the administration find leaders. If they wish to do it themselves, those who want to do it should find their own leaders. By the way, the leaders of the youth sports clubs are volunteers who are not paid. If leaders are publicly rewarded for the transition of club activities to the local community, then the leaders of the youth sports clubs should be rewarded as well.",382,29
"As for the cost, I think it is just a matter of getting it right, as the cost that should be paid has simply been obscured by the labor service of the teachers. As for the point about transitioning to the community, I think it is a good idea to have more options and more possibilities to participate in club activities that one wants to do, as well as more possibilities to receive more specialized instruction. In a society with a declining birthrate, it may become difficult to maintain school-based club activities even in urban areas, and I hope that this trend will spread quickly.",199,13
"I am the mother of a child who is currently in high school 1 and elementary 6. When my older son was already in the club, we practiced 4 times a week, 2 hours on weekdays and 3 hours on either Saturday or Sunday. I didn't feel like I could get good at it with that kind of practice time, but still we had club activities, and basically because of the rule that you had to join something, I joined the tennis club even though I wasn't good at sports, and I worked hard for two and a half years, and I think it was a great experience. The rhythm of being able to do club activities for two hours after classes, go home in the evening, and go to cram school is very good for junior high school students. Otherwise, they would go home and look at their phones for the rest of their lives. I think that club activities during compulsory education are very important as a rite of passage in life. I hope that club activities will continue to exist under the control of the school.",22,69
"I think it is necessary for the government to support instructors by encouraging companies to allow them to have side jobs, and to take measures such as tax exemption for their income. Also, no one will want to become an instructor unless the parents agree that they will not be held responsible for any problems that occur during club activities. However, in order for teachers to be able to work on weekends, I think it is necessary to eliminate club activities for which there are not enough applicants.",265,36
"I am a school teacher. I have devoted myself to coaching club activities for about 25 years. Thanks to your support, we have been able to participate in national tournaments for both men and women. Now we have changed our policy and made it a ""club"" at school, with activities lasting about one hour four days a week, and we can take a break at any time. Then, surprisingly, many students joined the club by crossing over to outside clubs. For full-fledged activities, we started a local club team. For this purpose, I became a certified coach. Some students who were not satisfied with the club have also joined. The club team has attracted many students from youngsters to junior high school students. The cost was kept as low as possible, with only the cost of insurance, equipment, and supplies. We also participate in official games of the Junior High School Sports Federation as a club team. I feel that the parents are very interested in the program. We no longer get angry at them for teaching. Anyway, they say, ""Today was fun! I made progress! I try to end the day with ""I had fun today! Some high schools are even allowing us to use their gymnasiums.",123,9
"I belonged to a sports club in junior high and high school, not a club. This is because my school did not have any club activities that I wanted to do. In Europe, after school, each student goes to a local sports club and participates in sports activities. At the sports clubs, each student works on improving his or her own athletic skills and joining with the local community. After sports activities, the students go to a restaurant or other facilities to have a meal or go home. The disadvantages of club activities in Japan are (1) increased burden on teachers and (2) sports coaching by teachers who do not specialize in sports. If the burden on teachers increases, their motivation for club activities will decrease and daily classes will be interfered with. In addition, the lack of professional coaching staff makes it difficult to improve athletic performance, and delays in responding to injuries occur. I believe that now is the time for club reform and the opportunity to move club activities to the local community. I hope this post will be of some help.",140,8
"The only way to continue the function of the ""club activities"" currently being performed by high school and junior high school teachers is to transition to the local area. There are some cases where there are no leaders in the region and the transition is not possible, in which case, unfortunately, we have no choice but to consider liquidating (in short, abolishing) the club. It is true that there may be disparities between regions, but that is something for the national and prefectural governments to think about, and I hope that each school will quietly go through the process of transferring club activities to the region, and if that is not possible, consider liquidation. If this is not possible, then I would like to see the schools consider organizing them. If I am wrong, we should not go against the times by having the current staff take over club activities.",90,4
"I have a child in a rural middle school with only one class per grade. I am in favor of having a club team, but many club teams play at night and it is difficult to combine with cram school. It is also difficult to take them to and from school each time. It puts a lot of strain on the parents, and I realize how blessed I was in my days when I could practice at school after school without thinking about it.",50,5
"In junior high school and high school, I was very much indebted to the teachers in my school club activities. I was a child at the time and did not understand how much of a burden I was placing on the teachers, but I believe that the current situation where we are overly dependent on the kindness of the teachers must be changed. It is a matter of course to move to the region, but we hope that we will be able to address any issues that come up in the future accordingly and create an environment where the children can have a good experience.",45,1
"I myself was saved both mentally and physically by club activities throughout junior high and high school. On the other hand, as I grew older, I came to understand that it was supported by the tremendous efforts of the advisors. After all, regional transition is necessary. However, if measures can only be taken at the level of the current club activity instructors, I feel that unfortunately club activities are likely to be reduced in the future. My husband is a club activities instructor at a high school. He was asked to do this by his friend, the advisor, and since it is an extension of his longtime volunteer teaching duties, he has been able to make it work, but I think it is a very rare case. With a capped compensation of several hundred thousand per year, a responsible job that requires highly specialized skills and educational awareness, a decent instructor is hard to find. Furthermore, the remuneration has been reduced this year, but how will they finance the transition to the local area? There is also the problem of finding places for daily practice and equipment (e.g., instruments for a brass band). I think the question is how serious the government is about club activities as a form of education.",38,8
"The significance of club activities should be properly understood from the perspective of education, what role they have played so far as school activities, and how they should be discussed in the future. Which role should be entrusted to the community? In terms of the burden on teachers, I think some of this can be solved by paying them an appropriate allowance. I am not sure if separating club activities from the school will be the only way to motivate teachers. I think that the loss of club activities will create new problems and burden on teachers because they will not be able to grasp the situation of children and provide guidance and training not only in the classroom.",16,18
"In addition to club activities, there are other clubs that are active in the community. Many local clubs are active once or twice a week for about two hours. Club activities are to be steered along the same lines, considering the transition to the community. School activities are also about twice a week. Competitions should be led by parents who see their own children. The goal is to completely separate the school from the school starting in the 2030 school year. Teachers who want to do this will see the activity as an outside leader in their own community. There will be no transfers, so they can do this all the time. If we do the activities twice a week, private clubs will start up and we will be able to separate the clubs for the purpose of community exchange from the clubs that attract children who want to do more.",99,21
"I think we should move to local club teams like in Europe. The reason for this is the issue of leadership. In the case of club activities, most of the teachers who are amateurs in development are single-handedly acting as coaches (or rather, people in charge), so there is almost no one who can guide them to the correct development as players while avoiding the risk of injury. There are also many faculty members who rarely show up at activities. Of course, there are some disadvantages. It is difficult to have many teams in a community, so the burden of attending can be a big one. As for the expense incurred, the question is whether it is better to ""get proper instruction because it is free, or to be left out,"" or whether it is better to get proper instruction and pay for it. Essentially, we believe the latter is preferable.",7,1
"I am an active public high school physical education teacher. I feel that I would like to see a regional transition as soon as possible. Schools are the most terminal of educational institutions. They mostly just follow the instructions that come down from above. Although they do take feedback from the field, or questionnaires, they basically just ""report"" to us. I have heard that the overwhelming majority of junior high schools would like to see the transition to the local community. However, most of the schools and institutions in the prefectures that are considering things related to club activities are probably physical education teachers who do not feel too burdened by club activities. If they are really interested in transitioning to the regional level, I think they need to discuss the issue, including working conditions, etc. I would like to see discussions involving unions, principals' associations, and other organizations that may have some influence among teachers in the field.",33,3
"Students belonging to club teams are now able to participate in this year's middle school competitions. For individual sports, it seems to be rather easy to transition to such club teams. As for team sports, the form will vary depending on the sport and the number of students, with school-based teams for school sports, and local teams for community sports. The problem is to secure instructors, and those who can teach after school and on weekends are likely to be retired senior citizens and teachers who wish to teach. The cost would be borne by the beneficiaries, but it would be realistic to ask teachers to submit a notification of dual employment to secure personnel.",6,2
"I am a middle school teacher. I retired this past March and am currently teaching on a reappointment basis. I have been an advisor for the volleyball team for a long time. With this experience, I have decided to start a volleyball club team. However, neither the students nor the parents in the community are interested at all. They do not give any support to the administration. It is very painful. I hope that they will help us move forward with the steps to transition to the community as soon as possible. Of course, we have no intention of accepting any money as an instructor. However, there will be money for gym fees, sports safety insurance, association registration fees, ball fees, etc. If the government does not back us up, the burden on parents will only increase. We are asking the government and the community. Please give some subsidies to club teams. Thank you very much.",16,18
"Teachers are finding that the significance of club activities is diminishing. Especially in sports-related club activities, good results in games give an advantage for higher education and employment. Parents have strong expectations for this. The children, however, may be genuinely striving toward their dreams. Why not leave such club activities to club teams? Even club activities in the arts, chemistry, and IT should be left to specialists. I think this is a better way to develop children's interests and individuality. Times are changing.",6,1
"I agree. The load on middle school teachers is too high when they take on club activities. Not only do they have to participate late on weekdays, but also on holidays, and furthermore, it is difficult to take paid leave outside of the holiday period. School teachers are a very important profession that influences children's personality development and future way of thinking, in other words, influences the future strength of the nation. Currently, I think it is difficult to say that excellent people, including in terms of income, are aiming to become school teachers. I hope that not only the club activities but also the overall treatment and employment conditions will be improved so that teachers will be respected in society. On a different note, I believe that various improvements could be made quickly if people who have worked in the private sector until their 40s or so could be hired as teachers or on school boards as a second career.",10,4
"I agree with the regional transition. The issue of ""financial burden on parents"" has been raised as an issue, but I think the issue of cost burden should be separated from this issue since this is a measure to reduce the workload of teachers in the first place. However, I think that the issue of cost burden should be separated from the issue of the burden on teachers, since this measure is part of the measures to reduce the burden on teachers in the first place. On the other hand, there are also many teachers for whom ""being involved in club activities"" is one of the reasons to continue teaching. Therefore, in the regional transition, I think it would be a good idea to allow teachers to work as ""regional activity leaders"" on the side, and to give priority to such people in the selection of regional leaders.",1,1
"We have small children and my husband is a middle school teacher. The school where my husband works has a dismissal time of 4:40 p.m., but club activities end at 6:30 p.m. He comes home after 7:00 p.m. no matter how hard he tries. No matter how hard he tries, he comes home after 7:00 p.m., which leaves him with only an hour or so to spend with the little ones. (We leave the house early in the morning, after 7:00 a.m.) On weekends, my husband has very little time to interact with the children because one of them is involved in club activities. When he has an occasional day off, my children would ask, ""Why is daddy off today? I have become almost a one-parent operation. I am almost a one-operator myself, and it is hard for me to rest. In the midst of all this, I cried in frustration when I heard about a student who said that club activities were a pain in the ass. I honestly wonder why our dad has to devote his precious time to such a child. Teachers also have families. Basically, I want them to work during working hours. I would like to see club activities separated from teaching.",7,1
"When I was in junior high school, the world was asking if we could work 24 hours a day. Compared to salaried workers, junior high school teachers could wear shabby clothes, work less overtime, and have full summer vacation, so I decided to become a teacher in the future! I decided to become a teacher in the future! I entered the education department, but gave up when I heard that only one out of tens of thousands of teachers would be hired because of the ""super ice age. Now there is a shortage of teachers, and at my son's school, the vice principal is being sent out to teach classes. I am so mad at the teachers at the school who work late, and there are so many families who need developmental support, and they are so detailed to each of them. They are really accommodating even though they have families and children of their own. The club activities should be shifted to the community to reduce the duties and responsibilities as much as possible.",14,1
"Although my high school was a public school, it had a club that was so active that it was chosen to represent the prefecture every year. The club had more than 100 members in the third grade, and many students came to the school because they wanted to play in the club. However, upon my graduation, the club's advisor moved to a new location. Although we secured an outside instructor once or twice a month, the club declined. We no longer represented the prefecture. On the other hand, after a few years, the school where the teacher was transferred was selected to represent the prefecture.... Was it really a good idea to choose a school for the sake of club activities, and was that the right career path for these children? Because of this kind of experience, why don't we just move the parts of the school that have nothing to do with academics to the community? I think it is a good idea.",71,5
"If it is a club activity, I think it should be carried out as far as possible as a school activity. To take this to an extreme, I think it would be difficult to continue unless the advisors are paid for overtime until school lets out completely after classes end on weekdays, with no weekends. If this is the case, it will naturally become difficult to win competitions, and some parents and students will complain. This is exactly the point that makes club activities difficult: are they doing it to win competitions, or are they doing it as a non-athletic activity and having competitions as a place to show the results? Personally, I think it would be better to do away with club activities, and if students want to play sports other than physical education, they should start their own clubs in the community and separate their activities from the school. In this way, there would be no room for dissatisfaction, since the activities would be carried out by those who want to do them without being forced to do so. I think that because it is done as a school activity, there will be people who have different ideas, and that will lead to dissatisfaction. I think it is time to rethink how conventions should be organized.",4,1
