comment,like,bad
"Tokyo Minato Ward and Nagoya City have already outsourced to the private sector, but I heard that some of the leaders, especially in sports club activities, are violent leaders. When outsourcing, since they are instructing children, they should be interviewed under more stringent standards. A system should be created to make it easier for children to speak up against such leaders, and then club activities should be managed accordingly.",1,2
"In fact, it is not nearly as advanced. This is because there is no one to take the place of teachers. Many people are still working in the evening, after school hours. Not many people are willing to give up their weekends and holidays to do it. In rural areas, it is also difficult to get to and from the practice site. The advantage is the reduction of teachers' overtime. Teachers will no longer have to be an officer of the federation for each sport. The disadvantage is that the schools will have to deal with problems that occur in club activities that have been moved to the local area. Lack of human resources in the federation. Club teams will be formed instead of club activities, but they will not be able to make ends meet and will not be able to operate. The federations of each sport also depend on club activities, so it is not easy to make progress. I feel that we will not be able to land on a good landing spot unless we take the plunge and abolish club activities at schools, instead of proceeding gradually.",7,2
"My husband is an in-service junior high school teacher and homeroom teacher and club activity advisor. He comes home at 9:00 p.m. on weekdays (he has to round up his work because it never ends) and goes to work every Saturday and Sunday, and on weekends separately. There are many students at the school where I work who are involved in activities outside of school. For example, there are kids who play soccer in the same club and kids who play on an off-campus team. For example, in the same soccer game, there are children who are involved in club activities and children who are involved in teams outside the school. Since the environment is available, I think it would be good for students to be able to play outside the school. I would like to see a change in the situation where students can participate in activities for free if they are part of a club, by calling in specialized instructors for limited activities, such as a brass band, for which outside activities are difficult for junior high school students, and by requiring students to pay a certain amount of expenses. If teachers were to register in name only, and if club activity instruction were reduced from their jobs, I think the workload for teachers would change dramatically. Without such concrete work improvements, I don't think the number of prospective teachers will increase.",6,1
"There are various issues involved in transitioning school club activities to the community. If the transition is made hastily, students and children will suffer disadvantages (e.g., injuries, inadequate guidance, etc.). Are the instructors capable of providing sufficient guidance? It is also strange that the school is not involved at all in the transition to the local community. I think that school teachers should be involved at the beginning of instructional time or at least in greeting the students. It is strange that the program starts with the elimination of overworked teachers. If overwork is to be eliminated, I think the number of teachers should be increased by reviewing the law on fixed number of teachers.",12,43
"The advantages and disadvantages have already been described in this news item, but it is probably a definite step in the direction of separating club activities from school education. The advantage is that schools can concentrate on their original educational tasks. They will be able to conduct research and preparation for subject instruction after school on weekdays and on Saturdays and Sundays, and will be able to develop more fulfilling classes. The disadvantage would be that it would be difficult to grasp aspects of the individual that can only be seen in club activities. As for outside instructors, the advantage is that they can provide more specialized instruction. In the case of teachers, it was often the case that they became advisors for club activities in which they had no experience at all. The disadvantage would be the availability of human resources. On weekdays, practice hours would be from 4:00 to 6:00 p.m. I wonder if there are people who can come to the club for instruction at such a half-way time. Financial resources are also a concern. We also need to be clear about what to do in the event of an accident and where to place the responsibility.",44,6
"The Chiba Prefecture Junior High School Tennis Federation has a closed-door approach to tennis, and although regional sports are allowed to participate in tournaments starting this year, they are not allowed to participate in individual matches (singles and doubles), only in team competitions. However, they cannot participate in individual matches (singles and doubles), but only in team competitions. Even if you win the prefectural tournament, you are not allowed to participate in the Kanto and national tournaments. The advisors of private junior high schools run the junior high school tennis tournaments, which is very convenient for them. I think it is not possible to make the transition to regional sports without improving these areas.",4,1
"I believe that the transition of club activities to the region is intended to reduce the burden on teachers. However, in order to transfer the activities to the region, local government officials and school board members are forced to work long overtime hours every day. The regional transfer of club activities is not intended to reduce the burden, but to transfer the burden from the teachers to someone else. Isn't this a real turnaround?",2,7
"I think that club activity leaders, whether teachers or regional contractors, should be paid well, and teachers should be able to choose which club activities they want to be in charge of. Depending on the club activities, the same teacher may have a very different workload, and some people become teachers because they want to do club activities and others do not. If salaries are paid well, the sense of unfairness and the feeling of being forced to do something can be reduced. If you can't even budget to pay salaries, you don't have to do club activities at school.",1,1
"Regionalization of club activities is a good thing. In other words, I feel that this is the only realistic measure that can be taken in accordance with the actual situation in the field of education. Unless the Ministry of Education admits its past mistakes and implements serious educational reforms, I believe that the local community will be responsible for classroom education everywhere. The day when the traditional profession of ""teacher"" will disappear from Japan is surely approaching.",3,1
"I am not sure if my experience from more than half a century ago will be of any help to you today, but at my school back then, we had a lot of fun (my personal opinion). Of course, as long as we were playing, we were concerned about winning and losing, but that was in its own way. The advisor rarely came to the practice field. He did lead us in games against other teams, though. In those days, it was not easy to watch videos to improve technique and share understanding of strategy and tactics, so the members looked things up in books, talked with each other, and thought about what kind of practice we would do. That is why we were a weak team. We would be overjoyed if we won once or twice in the regional qualifying rounds. Because we ran the team ourselves, I can't say that there was no infighting (especially between grades) or trouble within the team, but we were able to manage through discussion (as I remember it). I think the original purpose of school club activities is to deepen friendships while working toward a common goal through friendly competition among friends.",3,2
"I am all for moving club activities to the community. There is a limit to how much teachers can lead club activities. They are volunteers on weekdays, and on their days off, they are paid 3,000 yen no matter how many hours they lead. If there is an injury, the advisor is responsible. I don't even want to go to training camps. Only teachers who want to do it should do it. I want them to be released from club activities as soon as possible. Some of the young teachers now refuse to take part in club activities from the beginning, and the burden of this is becoming a burden on them. Do something about it as soon as possible.",8,1
"I am an active high school teacher. I believe that one of the goals of club activities is to participate in tournaments. Most of these competitions are run by teachers. Not only on the day of the tournament, but also before the tournament (sometimes several years in advance), a lot of time is allocated to preparation for the tournament. Moreover, there is almost no allowance for that preparation time. If we do not transfer the management of the tournament to the local region, no matter how many club activities are transferred to the local region, the club activities will not leave the hands of the teachers.",5,1
"If we consider the issue of how teachers work, the current situation, in which they are told they can work a fixed amount all the time and it is almost illegal, will no longer have to be changed. However, it will not be an easy transition to the region. How many personnel will be available to provide instruction for only two hours on weekday evenings? Based on the working hours, the monthly income would be about 100,000 yen, which is not enough for a young person to make a living. Some say they are retired old people, but what kind of expertise do they expect? Can we expect them to be patient and treat other people's children in the same way as teachers? We believe that club activities are very significant as a gateway to casual involvement in athletic and cultural activities of interest. It may even confer on a person's lifelong mental and physical health. In the theme of protecting teachers, only the negative aspects of club activities are focused on, but I believe that this should be a win-win solution for both teachers and children.",3,5
"I was slapped for no reason in club activities. I think there were club activities just to win, or to prevent delinquency, or for the convenience of the school, and serious teachers had doubts and difficulties. I think that this is what learning is all about. I hope they will expand nationwide soon.",1,3
"Regarding middle and high schools. I think it is easy to think that outsourcing school club activities to the community will make them better than they are now. It would be better to leave the current situation as it is, with teachers serving as advisors, but with outside personnel filling in to support some of the coaching, administrative work, tournament management, etc. I believe that club activities are also a place for teachers to find good points in students that cannot be seen in the classroom alone, and to provide detailed guidance (in areas that cannot be reached in the classroom alone). Don't you want to be an advisor because you don't like it or because it is a club activity you are not good at? Don't make me laugh. Can someone with that level of experience teach children who don't like or are not good at studying so that they can manage to do so? If you can't overcome your own difficulties, if you can't change yourself, what can you do for others? If you say that club activities are not necessary, are you also saying that you don't need a sports festival or a cultural festival? There are good and bad sides to everything. We should not emphasize only the bad aspects.",10,23
"I agree with the regional transition, but the school board's explanation is not clear with the whole process being thrown to the region. What about inclusion in the internal report when students enter high school? What about the physical, emotional, and financial burden on parents? I don't want the club to become a club, as it is too different from the previous club activities and it is clear that it will affect the future in many ways. I would like to see more concrete explanations and, if you are going to start, a system for the conversion of all club activities into clubs, and only then.",1,5
"Since there is so much trouble even among school teachers, who are bound by fairly strong ""gauges,"" it is frightening what the situation would be like if the school were opened up to the community. In fact, I have heard such a story. Regarding the transition of club activities for girls in junior high school and above to the community, measures against harassment are indispensable.",1,6
"First, I am concerned that we are not getting into a 0 or 100 argument. I am concerned that we don't have to forcibly move club activities to outside areas to where they are fine within the school as they are, and that we can properly choose whether or not to leave club activities to the community. I know this is extreme, but there is a female music teacher who has devoted her life to teaching club activities and has been active for over 30 years without getting married. It is no exaggeration to say that she became a teacher in order to teach club activities. I am concerned that such a person would be swayed by the voices of teachers who do not want to be club activity advisors. Changing the subject, the beauty of club activities is that anyone can easily participate in them within the school. If club activities are outsourced, monthly fees are incurred, and they are transformed into something that is no different from lessons, then this is nothing more than the mere abolition of club activities.",5,13
"I'm guessing that the people who are doing the good work here are the teachers and the people who are pushing the booing mark are the parents. My son has already graduated from middle school, so I'll write what I have to say, but I think the transition of club activities to the local area should be done with the teachers in mind. I think it is too black a profession. However, from a parent's point of view, I feel that I really appreciated the fact that the teachers at the school knew the characteristics of the children and taught them. Anyway, I think it is a bad thing that Japan does not spend much money on education. I think there should be more teachers and an allowance for club activities.",3,8
"The education budget should be devoted intensively to children (including kindergarten) up to the age of 18, and those over 18 (adults) should be responsible for their own education. Club activities, school lunches, school commuting fees, uniforms, and textbooks should all be free. Public schools should offer remedial classes for students who excel but are financially unable to attend cram school. For those students with excellent grades who have financial difficulties but wish to attend a private integrated junior or senior high school, a full scholarship and living support money (about the cost of a part-time job) will be provided. In any case, until the age of 18, we will support students regardless of disparities in academic ability, ability, motivation, and good conduct. After the age of 18 (college, junior college, vocational school), students are responsible for everything. Of course, scholarships with repayment and scholarships that are exempt from repayment will be offered to particularly talented students and to schools with a shortage of human resources, such as nursing and caregivers, if they enter professional jobs that will be in short supply in the future. Those with low academic ability & poor conduct who are unlikely to be able to repay the scholarship will not be allowed to go on to college or other schools. All private school subsidies should also be abolished.",26,3
"Even though we are working to reduce the burden on parents through measures such as free education as part of measures to address the declining birthrate and aging population, you are promoting reforms that may increase the burden on parents, the guardians, instead of reducing the burden on teachers. The pretext for these reforms is the declining birth rate, and the introduction of ""joint club activities with other schools"" and ""introduction of outside instructors. I don't think that reform of work styles is a matter of ""just shifting the burden""....",2,9
"There are two conditions for quality assurance of instructors: the first is the number of people weeded out before they are hired. It is necessary to ""make it so popular that there will be people who want to become instructors but cannot"" through a combination of training and other means. The other is ""liquidity"". This is because an organization quietly rots after decades in the same place. Based on these conditions, there are three possible methods. Each disadvantage is omitted due to character limitation. 1) Economic selection with a certain salary. In this case, provide an opportunity to fire or change instructors based on yearly evaluations from the student side, as in professional sports teams or orchestras. (2) Establish an examination system and make it an honorary position. Have people from already high quality places participate as honorary positions (emoluments), just as legislators in the Meiji era were chosen from the aristocracy. (iii) Set up as a local community circle with no age or other restrictions, and conduct it without a leader or with alternating leadership roles within the circle. In this case, it will be a kind of blockchain situation where everyone keeps an eye on each other.",1,2
"Club activities themselves should be abolished. Children who want to do something other than study can join lessons or club teams. I think the gap will widen, though. I and my three children are very happy to have been a part of ""club activities. It may have been hard work for the advisors, but it was a fulfilling student life.",5,1
"I don't think it will work as it is now. Only school education is making progress, and society is not really willing to accept it. Even telework is a system, but it is returning to the direction of requiring workers to come to work. Companies are putting their own profits first, and workers are putting their own lives first, so there is no mechanism to help them in any way. I understand the need to reform the way people work, but the reality is that it has become a rubbing-together.",2,1
"In the 1980s, there was an accident in which a student died during a club activity when the teacher was not watching. The accident resulted in a lawsuit and the school lost the case and had to pay a large amount of compensation. The school lost the case and had to pay a large amount of compensation. Before that, teachers could go to club activities after doing administrative work in the staff room, so there was relatively little leeway, but now there was no leeway at all. Frankly speaking, we should have thought about how club activities should be organized at that time, such as transitioning to the local area. There was no media coverage. At that time, it was extremely popular to beat teachers.",93,4
"In the first place, we need to think a little bit about the fact that all students have to join a club. It is fine if the students are only involved in club activities one or two days a week like in elementary school, but it is better for students who really want to join, but forcing them to join some club may cause them to dislike school. Especially in the sports clubs, those who have experience in club teams or youth teams can be regulars with the older students from early on, and those who have just started cannot keep up with them. Some children are having a hard time participating in club activities that are supposed to be fun. I understand the importance of cheering and other activities even though they can't participate in tournaments, but they have to stay at the venue from morning until evening. Depending on the size of the school, first-year students are not allowed to use the equipment they bought after entering the school. They can't participate in tournaments because there aren't enough players, or there are too many players, so they can't practice as much as they would like. I don't want to play club activities until I feel like that. Some students say that it is painful to have to listen to their advisors and seniors.",5,3
"I'm not a fan of the club, but I'm a fan of the sporting activities. But considering the huge burden on the parents, if the kids want to play but the parents can't help, can we secure the club members? Personally, I think that if club activities are carefully selected and teachers are assigned to specialize in club activities, it would be possible to secure club members and reduce the burden on teachers, parents, and the community.",3,1
"The intense workload of teachers is not a problem that can be managed by reducing one club activity. It is impossible to maintain the current school functions without dividing the workload between teachers who provide academic instruction and teachers who teach homeroom classes and club activities. Personnel costs will probably need to be increased by about 1.5 times the current level. Even if local instructors for club activities are introduced, those who have no experience in teaching will not understand that club activities are educational activities, and will tend to fall into the trap of victory supremacy. In addition, leaders who are competent enough to achieve both the personal growth of the children and the improvement of their athletic performance will not be regional leaders who do not earn much money. The number of former teachers tends to increase, but when the number of teachers without experience in teaching club activities increases and they retire, there will be no one left to be a community leader. This system of regional advisors is not sustainable at all. If we think that we have solved the problem with such a stopgap measure, Japanese education will soon collapse.",11,2
"As long as club activities are involved, teachers will not be able to work comfortably. Students will be dragged down for the rest of their lives with knee and back injuries due to the intense physical activities they do with their underdeveloped bodies. It may be difficult, but I think that sports and arts should be learned.",3,1
"I agree with the philosophy of regional transition. When considering specific practical measures, if we mix the issues of teacher work style reform, declining birth rates, and the lack of professional leaders in the search for practical measures, all of these issues will be halfway through. We should be bold and focus on the reform of teachers' work styles and discuss practical measures for regional transition. Currently, it is the job of teachers to secure outside instructors, and if teachers are required to do more work related to regional transition, it will be a complete disaster. Who will manage the people (instructors, parents, students), goods (facilities, equipment), money (fees for coaching, membership fee income), and information (negotiations with other organizations, local governments, junior high school federations, etc.) related to regional transition? The substance of teacher work reform will not change unless management and discretion are also transferred to the region, even if in stages over several years.",3,1
"I would have liked to join a karate club myself, but while there is some sort of judo and even kendo in regular junior high schools, there is no such thing as karate. With the declining birthrate, it is very difficult to find a sport you want to play nowadays. Even baseball and soccer teams cannot be formed. So it is nonsense to do it as a club activity in junior high school anymore. I paid to go to a karate dojo myself. Shouldn't it be the same for other sports?",2,2
"Eventually, both parents and children will shun the additional travel time and financial burden and will not participate in club activities. Most children will either go home and watch videos or get together and become delinquents. This will only make them unhealthy. Parents will be busy with work due to higher taxes and higher prices, and there will be few children who can aspire to do well on their own. The unhealthiness of children is going to become a social problem.",2,2
"The biggest problem is that there are many students who say that they go to school because of club activities even though they are not good at studying. But it's not right for teachers to be the victims of club activities, and there are also connections that are developed because of club activities. If you think that you can just do something about club activities while ignoring the underlying factors, you'll never solve this problem.",3,1
"Club activities should be run by students' voluntary activities, and there is no need to force students to join or to assign inexperienced advisors. Inexperienced advisors are unmotivated and cannot provide proper guidance, and even though there is a two-person advisor system, the experienced advisor ends up working alone. Only such hard-working advisors have a heavy workload, such as being the head of the school. The teachers who are busy are extremely busy, and there are quite a few teachers who are not busy. In order to close the gap, it would be better to move them to the local area so that they can focus on their original job as teachers. Some of them neglect researching teaching materials because of club activities. It's a complete reversal of the original plan.",2,1
