comment,like,bad
"I welcome this. I think it is a trend that will make everyone happy. Teachers will have less workload and students will be happy to learn more authentic instruction from specialized instructors. I think that regional disparities are an issue, but I think that the basics can be eliminated. The next issue is the compensation for instructors. How should instructors be evaluated? I have been working as an outside instructor for many years, and I would not accept a position if the remuneration is little more than a sparrow's tears. I think it would be ideal if it becomes a second career for athletes, so that they can devote themselves to competition without worry while they are still active. If they insist on full-time employment, they should be able to offer classes for preventative medicine for the elderly in the mornings and provide support services for teachers. It is currently more difficult to find someone who can teach on a part-time basis, so they should be employed full time.",9,4
"The number of club activities has decreased so much that there is no way to choose. I would love to join a junior high school club because it is a valuable time to experience peer and hierarchical relationships, but the variety is so limited, and I cannot increase the number of clubs because of the burden on the teachers. If you could increase the variety of activities in cooperation with the local community, I think it would be good for both athletic and non-athletic children to have more options and more friends to do what they like together, which would be good for their education. After that, it is important to lay the groundwork for who will manage and support these outside activities. If it is to be like a school activity, the budget will be too high. It is also necessary to have a lot of horizontal cooperation in terms of participation in tournaments and practice matches. It will take time to develop the current club activity system, and there will be many problems. I hope that the Ministry of Education and the Board of Education will not give up on the project and will take responsibility for its completion.",12,21
"Early transition is physically difficult. There are too many challenges. Especially in rural areas, it is impossible to pick up and drop off students if they are both working, so each school needs to have its own transportation to the practice site. If it takes a long time to get there, there is a possibility that students from that school won't even be able to join any local team. It is impossible to introduce a uniform system across the country with the urban measure where there are still many people and several regional teams can be established within a child's bike ride. In fact, rural teachers are against regional transfers. I think teachers really want to be paid overtime to take care of them, and I think we should just give them a decent allowance for that.",6,9
"In order for this measure to be successful, the initial costs must be subsidized. If the first participant bears the burden of securing a place for the activity, as well as tools to be used in common, those who join later will benefit. I think this is a bit unconvincing. I would like to see this kind of thing included in the initial design.",16,3
"The same is true for junior high and high school athletic federation tournaments and high school baseball tournaments sponsored by the Japan High School Baseball Federation, in which teachers are currently involved from preparation to operation. Even after the transition to the regional level, I believe that as long as there are tournaments, they will remain involved in some form or another. It is really hard work to organize the district, city, and prefectural tournaments, as well as the spring, summer, and newcomer tournaments. I am concerned that this behind-the-scenes aspect will be alleviated.",20,1
"If the change is from school-based to community-based, can't it be done with the support of the government? The administration could invite instructors, and the administration could pay for their expenses (individual use of personal items would be borne by the individual). The location could be set up so that the baseball and flower arrangement events are held at Daiichi Junior High School and the soccer and brass band events at Daini Junior High School, for example. If each tournament is held in your town, the local community will support it, and it may lead to revitalization.",70,33
"I am a parent of a junior high school student. In the countryside, there are no trains or buses, and students may not be able to participate in the club activities they want to do if they cannot travel by bicycle. It is also an area with heavy snowfall, so if students have to travel by themselves, they may not be able to go to school depending on the weather. Many households in the area have two working parents, so it is difficult for parents to take their children to and from school. Some children may or may not take the time to travel, and if club fees are too high, it will be like joining a club team instead of a club activity. The poor households will not be able to do anything. Also, the current advisor said that he became a teacher because he wanted to teach club activities. Can a faculty member teach if they wish to do so, even if it is an external transition? I believe that club activities are better within the school as well as for communication between teachers and students within the school. Isn't it wrong to think that in large Japan, urban and rural areas can be handled in the same way? We threw the Corona response to each municipality...",8,3
"Increase the number of teachers and administrative staff in schools to reduce teacher workload and provide adequate salaries. And of course, for club activities. What about the gradual transition of those with leaders to the local community? However, the leaders will not be there permanently, so what will happen when they are no longer there? This should also be taken into consideration beforehand. It is difficult to imagine that all club activities can be transferred to all regions (especially in rural municipalities), so we need to consider what will happen if students want to participate but cannot due to lack of leaders, or else the regional disparity will only widen.",3,3
"School club activities have the weakness that children's growth varies depending on the leadership and skills of the advisors and coaches. Whether or not a child can belong to a club with a good teacher is largely a matter of luck, and many children may not be able to develop their individual talents. I think that if children are able to gather under more professional instructors in the community, these problems can be reduced and the potential of children can be expanded. When a child wins a tournament, a banner is hung in the school building to advertise it, but the child should be the star of the show, not the school for the sake of the child.",22,9
"My son, a seventh grader, was on the basketball team until last year. Fortunately, a parent of a member of the team has basketball experience and is now teaching him, but the kids and parents are confused because of the sudden change. The kids and their parents are confused because of the sudden change. They are practicing hard for tournaments while feeling a sense of loss that the school and teachers have abandoned them. I understand the burden on the teachers, but I would like to see a step-by-step transition to the local area. Please think of the children first.",8,29
"In the big picture, I think the regional transition is necessary. However, I sometimes feel ambiguous as to whether this is really for the sake of the children or just a measure to prevent the loss of club activities for the time being. The situation would be different if the club activities were not sports club activities, which was discussed earlier, but cultural club activities such as brass band clubs that have competitions, etc. For example, in the case of brass band clubs, the competitions are held in the community. For example, in the case of brass bands, local music stores and music schools are expected to be involved in the transition to the local community, but the school will no longer have a third-party perspective in the purchase of expensive instruments. In addition, the involvement of gyms, classrooms, and other companies in both athletic and cultural activities could create an environment that forces children to compete even more than they do now. The presence of club activities in the current school education system is an advantage for children, with the exception of black club activities. In terms of teacher burden, I think it would certainly be better to promote a regional transition. It would benefit the children in a roundabout way. However, the method itself should not be to the detriment of the children.",11,19
"As the issue has already been raised, I think we should of course proceed, considering the burden on teachers. I have no objection to that. However, if we are going to move forward with the regional transition, we need to be well prepared. On the other hand, we should not proceed without such preparations in place. I believe that this would do more harm than good to the students. Reducing the burden on teachers is the most important thing, but we must also consider the students a little. For example, forcing the transition to a regional area and bringing in a poor quality outside coach who is abusive and favors some members of the club will not be good for the students. Such preparations should be put in place.",27,21
"We understand that the time children spend active in club activities can be a relief to working parents. Nevertheless, we believe that teachers should stop managing club activities. After all, managing club activities puts too much of a burden on teachers. Of course, there are teachers who are totally fine with it and would rather live for it. But that would be an exception to the rule, or else it would be a strange situation. Club activities are also working hours. The term ""educator"" should not be used to cover it up. The number of children is decreasing and it must be difficult to maintain the number of clubs. I think it would be better for the children to join private athletic and cultural clubs and fee-based facilities. For these reasons, I agree with the idea of moving the club to the local community.",21,2
"I am an in-service teacher. I don't think it is possible to transition all of them to the region. Major sports are fine, but what about minor sports? What about cultural clubs? What are we going to do? 1. the best thing would be to allow dual positions and let those who want to do it teach club activities and get paid for it. I think the problem is that there is too little differentiation between homeroom teachers and club leaders. I also think that teaching is a job that is difficult to replace. Therefore, no matter how many people are hired, unless, for example, the number of students in a class is increased to 30 or classes are divided by subject in elementary schools, I feel that even if more people are hired, the number of people who do not do the work will only increase.",52,14
"I would like to see them outsourced, but also leave a form for teachers who want to lead to raise their hands. I personally don't want to wait because I don't have a passion for it and I didn't become a teacher because I wanted to lead club activities. However, there are people who want to do it. Some people say that those people should quit and become outside instructors, but I think that is a bit harsh. The important thing is that club activities are voluntary activities of students. Therefore, it is not right for teachers to be bound by them. Teachers can choose not to be involved in club activities or to be involved. There are many teachers who do not get involved, so outside instructors are essential. Finally, it is important to note that whether or not a teacher is involved in club activities does not affect his/her performance. (Those who do are doing it because they like it.) I think it is like this.",6,9
"My friend's child is going to join a baseball team when he enters junior high school. The reason is that he is in his 6th year of high school and has been interested in baseball since the latter half of his 5th year, so it is not a good idea for him to join a youth baseball team. The club will accept a wide range of players from serious kids to beginners. My concern when it comes to the regional transition is whether there is a place for beginners there. The threshold will be higher than school club activities, and I wonder if this could lead to a decrease in the number of competitive players.",4,7
"I think it is necessary to create an activity organization with the involvement of the government, not as a receptacle for club activities, but with an eye toward the development of the elementary, junior high, and high school age children, and to abolish club activities themselves. If a private company with a view to competitions gets involved, it is obvious that they will become victory-oriented in order to win children. It's too early to say, because there are quite a few private high school clubs where that is the case.",13,1
"I am in favor of moving it to the region. There were times when I felt that teachers gave preferential, if not special, treatment to students in my division. In general, classes for major subjects should be basically the same nationwide satellite classes, and only the follow-up classes should be given by teachers. I think this would eliminate the unfairness of the teachers. I asked a friend of mine about his salary, and he said that although teachers may be lightly paid in terms of hours, it is usually higher than that of ordinary civil servants. I was actually surprised because I had thought that the news reports said that the work was hard, there were no holidays, and the salary was low.",5,5
"Not only in sports, but it is common for school teachers to throw out what they cannot teach at school to outside organizations. Not only is it common, but it is also common for schools to have local schools help with school events free of charge with the attitude that they don't care about the curriculum of the various schools and practices. If you outsource, you have to pay proper remuneration, and I don't think it's right to treat outsiders as if they are volunteers just because it's hard for teachers. If you can't do it, you may need to get help, but don't you need to scrutinize the situation, such as quitting? I think that sports, arts, and special studies should be taught in a non-school environment so that they can grow in their abilities.",17,23
"It seems that club activities can now be transferred to local club teams or dojo and participate in Jr. High competitions, but it will cost 40,000-50,000 yen for hearings and further training for the person in charge to register. Who is going to pay for this? For group sports, but for individual sports, the burden per person is too great. Why are the hurdles so high when the reform is intended to encourage children to continue playing sports and expand the scope of each sport, but the burden on teachers is too great and there is a shortage of instructors?",10,3
"I'm all for ""regional migration."" When I was a student myself, I was very active in club activities. When I was in elementary school, I was a member of a team made up of children selected from various schools in the area, but when I entered junior high school, I had to join the club activities of each school. At the time, I remember feeling a little uncomfortable about this. In addition, the elementary school team had a total of five coaches who regularly competed in prefectural tournaments, but in junior high school, there were two coaches: the teacher in charge and a deputy teacher. It is true that we are putting a burden on the teachers who have taken on the job almost exclusively on a volunteer basis, but when we think about the future growth of the children, we think that they would be happier if they could make a ""regional transition"" and play at a higher level, aiming higher. You should do high school too.",3,1
"I think it's great that the transition to the local community is happening, but there are a lot of people who have flexible hours for weekday club activities,....... I also coach elementary school sports, and it's true that there are a certain number of volunteer instructors who are strange.  There are many hurdles to overcome.",5,1
"I am all for the regional transition of club activities. My child is in an athletic club at a middle school. In the case of public junior high schools, you can't choose the school, so it is up to luck whether you have a good advisor and your child can grow. The advisor at my child's school does not participate in club activities and only practices on his own every day, so the kids who want to improve are frustrated that they get no guidance at all. Schools with enthusiastic advisors are always in the top ranks in inter-school competitions. We would like to send them to a club team if there was one in the area, but the transportation is very bad and we have to drive to and from the school, which is difficult for a working family. I always wonder if this environmental disparity can somehow be resolved.",3,3
"I want you to know that some of us are forced to change the club activities we take on because of school circumstances or because of staff members around us who do not want to play club activities. The know-how of the practice of the sport, the time spent studying to obtain it, and the relationships between advisors, all acquired over several years, are all par for the course. If you say that club activities are important, try having club activities outside of your specialty. I want you to know how hard it is to learn from scratch in a world you know nothing about, where students are more capable than you. Especially PE teachers, please try to have a cultural club. I still want to do club activities. Can you say it is important? I keep feeling self-loathing that my students would grow more if they had someone with more expertise as their advisor every time. That is why I would like to see a transition to the community and have someone with expertise to teach. And I hope for a society where those with expertise can teach high school students without having to choose a teacher.",3,1
"Not to move it to the community or anything, but just get rid of the club activities themselves. If there is something they want to do, they can pay a monthly fee to learn. I think it would be better to do away with the current system in which club activities give students an advantage in entering high school. The future is largely determined by which high school you go to. What is important for children is studying, and they should have more time to study.",30,5
"Only in Japan are teachers forced to join club activities and are also required to be involved in coaching. In other countries, club activities are either organized jointly with local sports clubs, or the burden on teachers is so heavy that club activities themselves are not even considered.",35,2
"I am a high school teacher. My own children are now adults and usually live freely. I am currently the advisor of the boys' athletic team, and since I have been playing the same sport for many years, we sometimes go into practice together. The coach is a man and I am a woman. We share roles and I teach them about daily life. They are high school boys, but they consult with me about everything from school to their personal lives. I think they probably talk to me about things they can't even tell their parents. They are like family. I miss seeing them on days when I can't attend club activities because of other work. If we were to transition to the community, we wouldn't be able to build these relationships anymore either.",5,14
"The soccer and baseball teams at the elementary school my child attended were taught by volunteers from the community who opened the school grounds to the public free of charge. Even in junior high and high school, famous schools and private schools seem to have appropriate people teaching. （In this respect, I think it is reasonable to pay an honorarium to have an outside person teach and the school only provides a venue. If teachers concentrate on teaching and other activities, and do not open themselves up to club activities, which are a form of overtime work, I think there will be no one left to become a teacher. In addition, there are students for whom club activities are sufficient even without a leader, and I agree with this style, at least in the sense that it reduces the teacher's workload.",10,2
"It is a basic premise that teachers need to reduce their workload. However, there are some areas where there is not a good off-campus environment, and club activities are a good opportunity for children who are unable to take lessons (especially due to financial problems). I don't think it is possible to eliminate all club activities in the whole country at once. I am also worried about the lack of exercise for children who have to participate in some club activities, because I think there are a lot of people who used to be in sports clubs because they are not bad at sports. If you ask me what should be done then, I can't give you a clear opinion.",3,1
"Leave it to the local leadership. Before that can happen, we need to elect that leader. And we need to establish a method for selecting those leaders, etc. We need to determine the suitability of the instructors at a training session. On the technical side, I think we should consider cooperation from various professional sports organizations. I think the same applies to the humanities. To go that far would require considerable financial resources. I have high expectations for the Ministry of Education, Culture, Sports, Science and Technology.",1,1
"The best landing place would be to completely separate all club activities from schooling on Monday, Tuesday, Wednesday, Thursday, Friday, Saturday, Sunday, and holiday competitions. There is no such thing as ""bridging the experience gap in club activities."" Rather, it is the opposite. For example, if you are from an area where it doesn't snow, even if you want to play ski club, you can't, but the experience gap will never be closed. For example, if you want to take piano lessons but it costs money, there is no ""piano club. It is natural that people who ""want to be able to play the piano"" take piano lessons for a fee. Therefore, it is desirable to pay for what you want to learn. We believe that the final and reasonable landing point is to shift all club activities to activities in the community. This will increase the number of people who are active in the community and revitalize the community. And if people know that a certain area is active in a certain activity, it is possible that people from all over the country will gather there during long vacations and other events.",10,3
"I think the regional transition is fine. I think the problem is that club activities are becoming more like clubs. Maybe it's just my son's school, but it's noticeable compared to the past that students can't greet each other, are lazy, etc. Some people say that the times are different now. However, if club activities are a part of education, I think that without the fundamentals of greetings and attitude toward work, there should even be no club activities.",7,2
"Before considering the regional transition of music club activities, the government needs to make a clear judgment on the ""payment of performance rights fees. Many people are unaware of this, but JASRAC has begun collecting performance right fees from music schools after a court ruling that a teacher showing a model to students in a music class is an ""act of performance for the purpose of being heard by the public,"" and therefore, performance right fees should be paid according to the time of the model performance. Club activities do not require payment of a performance right fee because the school is a non-profit organization that does not collect any nominal amount of money from the students and does not pay any nominal amount of remuneration to the teachers. However, if the region is transferred to a different region and the instructor is paid a transportation fee or some other gratuity, it is no longer free of charge and is subject to the collection of a performance rights fee. However, if the club activity leaders are to be transferred to the regional level and the instructors are to be paid travel expenses or some other gratuity, they will not be paid nothing and will be subject to the performance right fee.",11,1
